,review_clean,Word_Count,review_rating,review_datetime_utc
3462,buying load to other networks takes at least 1 hour,10,3,2018-01-15T07:02:04.000Z
3463,sometimes it works sometimes its not,6,3,2018-01-15T11:34:29.000Z
3464,744 pm 1152018 hay binawasan ako ng gcash balance na 50 pero hindi niload walang nareceive na load gamit yang gcash app na yan gs50 tm at tama naman number fix nyo yan,33,1,2018-01-15T12:51:39.000Z
3465,why we force to watch this ad everytime in youtube what the its annoying kakagigil amputek wala pang skip ad,20,1,2018-01-15T13:42:39.000Z
3466,just keep the good services ,5,5,2018-01-16T01:39:38.000Z
3467,the app is always not available most of the time the load doesnt get through even if it does it fakes too long for the person tk receive the load,30,1,2018-01-16T03:09:29.000Z
3470,kindly fix your system please,5,5,2018-01-16T13:31:49.000Z
3471,50 rebate nasan na tagal na nun dipa pumapasok rebate bumibili ako ng load nababawasan balance ko pero di pumapasok load saka add nden kayo alltext10 sa next update,29,1,2018-01-16T16:51:59.000Z
3472,after the new update it always says there seems to b a problem please try again later code hjl2 please fix this what a waste ,25,1,2018-01-16T17:21:49.000Z
3474,its a good app but im having a hard time verifying my account,13,3,2018-01-16T23:38:41.000Z
3476,amazing apps love it,4,5,2018-01-17T01:51:15.000Z
3477,cant use my amex after update invalid card number pls fix asap,12,1,2018-01-17T03:28:43.000Z
3482,cannot register to american express  virtual pay,7,1,2018-01-17T15:39:14.000Z
3484,napakasinungaling ng globe na to nung nag apply ako for gcash sbi skin may makukuha dw akong 4 rebate pag nagsend ako ng pera gcash to gcash pag nman dw ngbyad ako ng kahit anong bill like halimbawa meralco 2 rebate nman dw pero nkailang send at byad n ko wla pa din ako nkukuhang rebate nung december nman ngtxt skn si gcash may matatanggap dw akong 50 rebate once n bumili dw ako s sm dept store at mgbyad s mobile lane gamit ang gcash card ko takte khit pisong rebate wla nman binigay napahiya tuloy ako sa mga brkada ko binida ko pa nman ang gcash nyo at inalok n kumuha tpos eto gagawin nyo sa loyal customer nyo mga wlang hiya tapos eto pa ha ngpalod ako sa gosurf50 na may 50 rebate dw pag niloadan mo ung self number mo ayun sa una at 2 beses natatanggap ko pa ung rebate ung mga sumunod hindi na bwisit na yan paasa pa more globe ayusin nyo nman ang service nyo hindi nman kailangan manloko at mag imbento ng kung anu anong promo pra lng kumita kau imbes na dumami tuloy ang tumatangkilik sa inyo nababawasan pa dhl nadidisappoint sa ginagawa nyo wala kaung kwenta magsara na kau gigil si ako,213,1,2018-01-17T17:20:39.000Z
3485,thank you for this app i can easy pay bills and buy load,13,5,2018-01-18T00:21:30.000Z
3486,my account was locked and i cant open it all of my money was there give it back,18,1,2018-01-18T08:30:45.000Z
3487,use  my  code  guysss  y9jbuy,5,5,2018-01-18T14:31:18.000Z
3488,i love this apps,4,5,2018-01-19T02:51:38.000Z
3489,cant log in my account and my mpin is correct,10,1,2018-01-19T05:15:44.000Z
3490,pwede bang mag transfer ng funds using paymaya to gcash,10,2,2018-01-19T07:49:34.000Z
3492,why does not work on globe lte,7,1,2018-01-19T09:45:50.000Z
3493,i just want to try it,6,5,2018-01-19T11:29:43.000Z
3494,i cant log in to my account,7,2,2018-01-19T17:00:59.000Z
3496,dissapointed ako kasi nag cashin ako sa 711 kanina hanggang ngayon zero balance parin gcash ko  bakit naman po ganun tama naman po ang barcode at reference number ko pwede ba i refund sa 711 yung  i cashin ko kanina  akala ko kasi delay lang  pero namuti na mata ko sa kakahintay  suko na ko,55,1,2018-01-19T22:59:07.000Z
3498,hard to verify this account please verify my account im waiting     yes im verify at globe sm masinag thanks,19,5,2018-01-20T02:37:23.000Z
3500,it will help me to pay app,7,4,2018-01-20T06:04:50.000Z
3502,i like it but i forget my code,8,5,2018-01-20T07:58:40.000Z
3503,the verification app in messenger does not respond when i type my phone number for me to move forward with the process,22,1,2018-01-20T09:32:37.000Z
3504,i love g cash,4,5,2018-01-20T22:27:47.000Z
3509,puta ang bagal ng process,5,1,2018-01-21T05:53:24.000Z
3511,how do i get my mpin,6,5,2018-01-21T06:32:26.000Z
3513,thank you gcash sa pa free mo palagi ,8,5,2018-01-21T11:10:48.000Z
3515,cannot enter my prepaid mobile number,6,2,2018-01-21T22:04:05.000Z
3517,excuse me butitong app na ito napakabulok tinawagan ko na walang nagsasalita naka globe naman ako naka globe switch ako may gcash daw na may 50 php pag naredeem mo ung code eh sinibukan ko walang nag message na code napakabulok ,41,1,2018-01-21T23:34:36.000Z
3519,very good app makes online payments very easy for thise with no credit card,14,5,2018-01-22T02:24:38.000Z
3521,would always in maintenance would like to refund all of my money back useless,14,1,2018-01-22T05:40:37.000Z
3522,i dont think soo,4,5,2018-01-22T06:25:30.000Z
3523,can open it says incorrect mpin my account is locked,10,1,2018-01-22T06:41:55.000Z
3528,this app is not usefull very very poor customer serviceive waited 1 week for the verification of my account but still no one from them contact mepaymaya is much much better than this,33,1,2018-01-22T23:41:19.000Z
3530,i very disapointed about this appsit says once i was registerd with amex ican receive the amount of 100phpafter wating fot about 6 days still dont received those amount instead they block my wallet i got suspendedi got suspended without any reason and dont have any idea how i got suspended since there is no warning any sms received from themdid my effort wasted on this appplx rep,68,1,2018-01-23T06:47:25.000Z
3531,kainis na app to walang kuwenta,6,1,2018-01-23T08:14:50.000Z
3532,i cant pay with my bills i cant input my references no  pls fix it,15,1,2018-01-23T12:51:16.000Z
3536,incorrect mpin i logged in with the correct mpin now my account is locked fix please,16,1,2018-01-24T02:14:02.000Z
3539,thanks gcash u made it easy for me,8,4,2018-01-24T04:45:04.000Z
3540,7 eleven barcode generator niyo ayusin niyo hanggang ngaun wala lang pumapasok  na pera sa akin nagemail na rin ako sa inyo   imessage ko ung gcash care  eh di nga sila nagrereply eh puro autoreply lang marereceive mo doon,39,1,2018-01-24T07:18:15.000Z
3541,its good but you need to make more choice to earn gcash,12,5,2018-01-24T07:22:49.000Z
3542,loving the new interface will redownload this for pasaload and billing info,12,4,2018-01-24T07:36:25.000Z
3544,plss amex help me,4,4,2018-01-24T11:53:50.000Z
3545,hello friend use my code to get 50 pesos 7x45qv  thank you,12,5,2018-01-24T12:17:21.000Z
3547,id give it 5 stars if you will bring back the autoloadmax to gcash feature 3,16,2,2018-01-24T17:16:08.000Z
3548,poor customer service you should change your gcash customer service response time from typically replies in a few hours to typically replies in a year useless app,27,1,2018-01-24T23:47:40.000Z
3549,i think this is good,5,5,2018-01-25T01:35:25.000Z
3550,everytime i enter my mpin it says that it is incorrect i just login a few hours earlier i always need to reset my mpin and contact the gcash support,30,1,2018-01-25T02:41:48.000Z
3551,so good this app ,4,5,2018-01-25T03:09:23.000Z
3556,this app is very useful in my everday life,9,5,2018-01-25T08:28:37.000Z
3560,saves me from travelling to payment centers,7,5,2018-01-25T08:31:39.000Z
3561,the app is so user friendly and have cool graphics design makes my boring cash payments exciting and less of a burden also never thought of buying load that easy thank you gcash ,33,5,2018-01-25T08:36:51.000Z
3562,the gcash app is like a onestop shop for me i have access to my gcash wallet and i am able to do all my financial transactions like send money buy load to all network shop online and pay my bills it saves me time because all of these transactions i can do on my mobile phone i love it,60,5,2018-01-25T08:41:45.000Z
3563,it was a better application can be used for scan to pay and bills payment with an instance response on my mobile phone in a second a quick and makes my life easier kaya igcash mo na yan guys,39,5,2018-01-25T08:44:00.000Z
3564,i have been a subscriber of the gcash for a long time and i find it really reliable and safe in all services it offers most especially in paying bills buying load and sending money it also comes with the movie transactions and i got a gcash mastercard which made easier in purchasing items gcash just makes life easier and im one of the satisfied customers ,66,5,2018-01-25T08:44:13.000Z
3565,works great convenient for your bill payments and other transactions,10,5,2018-01-25T09:07:49.000Z
3566,been using the gcash for so long now the app even makes the service better bills payment and prepaid loading iseasy and accessible also convenient for online shopping  qr payment ,30,5,2018-01-25T09:41:53.000Z
3568,safe and convenient    gcash is a very safe and convenient way to pay my bills and reload my prepaid phone numbers also there are lots of ways to reload or cashin my gcash because 711 stores are everywhere oh one more thing the scan to pay i really love it,50,5,2018-01-26T00:35:07.000Z
3569,it so convenient to use without any hassle paying bills and shopping  thanks gcash love it ,16,5,2018-01-26T01:08:30.000Z
3570,sleek and easy to use been more than handy in many payment situations eg paying my globe bill no cash on hand 711 barcode feature and qr payment is so convenient too  looking forward to more,36,5,2018-01-26T01:23:17.000Z
3571,very useful and convenient,4,5,2018-01-26T01:25:51.000Z
3572,super fast and efficient the only mobile wallet i need to be honest,13,5,2018-01-26T01:42:30.000Z
3574,gcash makes everydaylife easy from paying my daily rides to paying my online purchases and more i love how the app is built makes payments so much easy saves me a lot of time too also its amazing how buying load for my family members is a breeze i get to send them load and get undeniably quick rebates i hope to get more out of the gcash experience with this app so happy it doesnt disappoint,77,5,2018-01-26T02:33:09.000Z
3575,i think what i know to say,7,5,2018-01-26T03:12:36.000Z
3576,incredibly convenient best mobile money app so far in the philippines lots of discounts and very smooth interface with regular updates,21,5,2018-01-26T04:05:13.000Z
3577,useless app couldnt pay my pagibig contri always says invalid amount i dont know how they want you to input an amount i input 100  still invalid 10000 still invalid this app app is not a help it will just frustrate you i even called costumer service not much of a help,52,1,2018-01-26T05:40:49.000Z
3578,helpful for me when buying a load for my sons,10,5,2018-01-26T06:05:20.000Z
3579,a great help to us when buying a load and sending money also used for my grab account,18,5,2018-01-26T06:07:49.000Z
3580,useful app secure and convenient payments online and offline i use gcash everyday for sending money pay at merchants qr and mcamex i also use the book movies service and pay bills to skip the lines and the traffic love gcash,41,5,2018-01-26T06:44:14.000Z
3581,dont download their app kapag nagka problema kayo sa app nila or sa load hindi naman sumasagot ang gcash care sakanila babawasan nila load mo pero hnd naman successful ung transaction,31,1,2018-01-26T07:02:48.000Z
3583,safe na safe load ko d2,6,5,2018-01-26T08:55:32.000Z
3584,please verify my account,4,3,2018-01-26T09:44:09.000Z
3585,kung 10 lang sana ang rebate sa load ito na gagamitin ko edit ok na sana ang 10 na rebate ang kaso ang tagal ng load dumating nakakahiya sa mga nagpapaload sa akin mas maganda pa rin yung isang apps na gamit ko instant ang load,46,1,2018-01-26T13:57:29.000Z
3586,it will be more helpful and useful,7,5,2018-01-26T15:01:51.000Z
3587,what do u mean by cashin need specific answer thank u,11,4,2018-01-26T16:36:55.000Z
3588,alabg jwenta bumili ko ng gs50 pero d ko nman natanggap yung gs50 ko pero nabawas sa g cash ko yung 59 pesos anu ba yan promo n d totoo tas kinuha pa 50 ko kunwari p kinukuha yung number para mfix yung issue pero ala nga cla hotline n pede tawagan pinaglololoko lang tayo nyang g cash na yan mainam kumuha ng load oero pagdating sa mga issue o complaint alang kwenta ,73,1,2018-01-26T16:53:54.000Z
3590,uhmm its ok but how about the gcash card dinownload ko po kasi sya then iwant a card pwede po ba na dto nalang gumawa tgen i rerecieve ko nalang,30,4,2018-01-26T23:25:50.000Z
3591,yes verify me now,4,4,2018-01-27T00:06:42.000Z
3594,go with paymaya more userfriendly,5,1,2018-01-27T06:09:41.000Z
3595,how to recover password,4,2,2018-01-27T07:19:30.000Z
3596,everything is almost perfect the only problem of this app is a delayed transaction history can you make it in realtime,21,4,2018-01-27T10:46:03.000Z
3598,wala namang pinamimigay na 50p as globe switch promo,9,2,2018-01-27T15:01:21.000Z
3599,i am so surprised and disappointed to know that globe do not provide protection to their customers globe is not taking accountability to the fraudulent issue that happened to my aunts gcash account they declined the claim without any valid explanation and even wanted us to shoulder the expenses of requesting for the cctv footage from the bank where the fraudulent activity took place very incompetent unsatisfactory and unacceptable we do regret a lot that we opted to use and trust globe with our money transfer activities very sad,89,1,2018-01-27T16:59:19.000Z
3602,use my code wed4eu,4,1,2018-01-28T08:40:49.000Z
3603,hope this app will help a lot to me,9,5,2018-01-28T09:58:21.000Z
3605,i can not open my gcash please fix your gcash,10,1,2018-01-28T16:47:34.000Z
3606,never allowed me to buy load to other network2882 always says sorry you  are not allowed to do this transactionwhy,20,3,2018-01-28T16:53:08.000Z
3607,i cannot registered plss help me,6,2,2018-01-29T00:26:21.000Z
3608,its so convenient to use when sending money to friends or paying in places that accept gcash i dont have to bring out my wallet or count cash so convenient to cash in in 711 also plus lots of cashback promos,41,5,2018-01-29T02:02:15.000Z
3610,i always try to verify my account yet theyre not responding i message them a lot of times still no response,21,2,2018-01-29T03:00:31.000Z
3611,blocking the low securety account can not retrieve,8,1,2018-01-29T03:05:37.000Z
3612,problems 1st card purchased in cebu could not do atm 2nd card i had to buy in manila has problem,20,4,2018-01-29T04:39:07.000Z
3613,easy to use like send money buy load and other transaction in gcash app ,14,5,2018-01-29T06:09:47.000Z
3614,easy to use and low transfer rates,7,5,2018-01-29T06:21:38.000Z
3615,very useful app especially for sending money and paying bills no need pumila ng pagkahabahaba sa banks or bayad centers pay anytime anywhere hassle free,25,5,2018-01-29T06:31:11.000Z
3616,i cant register no matter how many times i tried to input personal pin for registration ,16,1,2018-01-29T06:53:33.000Z
3617,very convenient and easy to use its very secure plus the promos helps save money,15,5,2018-01-29T06:54:59.000Z
3618,bskit ang tsgal dumating ng load sa smarttnt ngagalit tuloy suki qpki ayos nman ponadodoble tuloy send q ng loadlugi,20,2,2018-01-29T06:58:22.000Z
3619,very convenient and viable alternative to sending money and paying bills tracking your transactions digitally is also a blessing,19,5,2018-01-29T07:05:55.000Z
3620,very easy to use safe and convenient,7,5,2018-01-29T07:50:47.000Z
3621,usefull apps thanks gcash ,4,5,2018-01-29T08:13:09.000Z
3622,sa dinamidami ng empleyado ninyo why verification of mobile number took so long tamad bang mga tao nyo,18,1,2018-01-29T09:24:45.000Z
3623,hanggang ngaun d nyo prin ginagawa account ko madameng laman un 3 times lang ako nag kamali sa 4digit mobilepin after nyan d na marecover at nag message ako sa inyo sa fb d nyo nman inaasikaso wlang reply pano kung example na my laman na 500000 un anu un d nyo nlang aasikasuhin  anu po b purpose ng gcash care nyo sa messenger,64,2,2018-01-29T13:03:08.000Z
3624,its everything you need thanks alot gcash,7,5,2018-01-29T13:17:14.000Z
3625,i cannot use my gcash wallet using the gcash app i need my money inside my account when im checking via 143 i have zero credits in my gcash wallet please fast track fixing your system,36,1,2018-01-29T14:37:24.000Z
3627,i forgot my pin can you help me this i very useful to me 0,15,5,2018-01-29T16:24:38.000Z
3631,sana ibalik nyo ung feature na pwede iconvert ung load to gcash,12,1,2018-01-30T01:30:28.000Z
3632,love the services esp on paypal and bills payments,9,4,2018-01-30T03:03:34.000Z
3633,verification should not take a week  if only there were alternative ways,12,1,2018-01-30T03:29:58.000Z
3634,very unreliable we are unable to pay our bir transactions my money got stuck in this unreliable app cust service sux not even good enough to show empathy to apologize for the inconveniece caused,34,1,2018-01-30T10:44:54.000Z
3636,i cant view my transactions,5,3,2018-01-30T14:18:58.000Z
3637,how to get my mpini cant use my gcash app,10,4,2018-01-30T14:53:31.000Z
3638,the most convenient mobile payment service in the philippines with the biggest perks and widest range of services  a true life saver  thanks gcash,24,5,2018-01-30T15:03:00.000Z
3639,i will definitely show this to my friends if we can cash in using prepaid globe load for us teenagers,20,1,2018-01-30T17:32:52.000Z
3641,awesome updates lalo na yung generate bar code for cashin sa mga 711 napakalupeetttt,14,5,2018-01-30T22:12:23.000Z
3643,please extend the 10 rebate,5,3,2018-01-31T05:01:24.000Z
3645,update the app so we can send money to paymaya thru the app and not thru 143 only come on paymaya has send money to gcash in app also paymaya to gcash has no service charge,36,3,2018-01-31T09:17:45.000Z
3646,keep on popping up which irritates me,7,1,2018-01-31T09:46:48.000Z
3647,napaka ng gcash walang silbi ang costumer service nila nakailang tawag na aq nakakains san ba pedeng pumunta na outlet ng gcash para iconsern ko yung si ko na withdraw na pera nabawasan ang pera ko sa gcash,38,1,2018-01-31T13:00:19.000Z
3648,yung totoo di na naman maka transfer na balance from paypal,11,2,2018-01-31T21:24:57.000Z
3650,i just installed the app today to use my gcash account but i forgot my mpin already i received a text that says to call the 2882 hotline to seek assistance hoping for me to reset my mpin i tried calling the hotline and your operator sucks it didnt give options to reset my mpin how am i going to log in to the account if i dont know the mpin and you wont let me reset it so what i should do now,84,3,2018-02-01T01:01:30.000Z
3653,where is the 50 discount for every load of gosurf50,10,3,2018-02-01T12:25:18.000Z
3655,okay naman sana kasi mabilis magcash in from paypal pero lagi nalang may problema paulit ulit kailangan magrelink ng paypal account tapos mapili din sa cellphone model ang issue ko ngayon is kahit nakanougat na ko nagka crash naman ang app everytime i click okay after maenter ang paypal account so pano pa malilink yun wala manlang customer service assistant para maresolve agad ang issue puro recorded voice lang naman sa hotline at yung fb chat ilang araw bago magreply hindi nyo ba naisip na urgent ang mga issues ng customer nyo baka kasi yung perang dapat na mawithdraw eh kailangan ng gamitin one week sahod ko pa naman iniexpect ko tapos hindi ko makukuha hay gamit ako ng kitkat na cellphone naenter ko ung email tapos nakalagay click close and continue tapos hanggang dun nalang dapat may lalabas pa dun na another popup window kaso nastock na sa close and continue so ulit ulit na naman nagdoble na yung input sa paypal aigoo,164,2,2018-02-01T23:12:12.000Z
3656,i registered gcash from january 22 2018 until now february 2 2018 wala parin di parin maka activate,18,2,2018-02-02T00:01:05.000Z
3657,i just installed it registered and applied the authentication code all was good until i was asked to login mpin code without even  asking me to input my mpin code who knows what my mpincode is when they never gave me a section to put nor provided me with a temporary code they never even gave me a section to put a recovery account how can i guess or recover my nonexistent mpin code,74,1,2018-02-02T02:58:24.000Z
3658,can i buy starlight emmber in mobile legenfds,8,1,2018-02-02T03:44:43.000Z
3661,very useful and hassle free thaank you gcash,8,5,2018-02-02T08:37:40.000Z
3664,my account is locked can you give me a temporary mpin,11,5,2018-02-02T12:44:15.000Z
3665,where is the log in button tapos na ako magregister i need to log in na lng pero nung iaaccess ko register ulit,23,1,2018-02-02T14:38:00.000Z
3666,more option for easy checkins,5,5,2018-02-02T19:07:28.000Z
3667,it says all my 3 globe and tm numbers are not globe or tm numbers,15,1,2018-02-03T05:16:20.000Z
3668,gosh it takes forever just to verify my gcash app account useless,12,1,2018-02-03T05:34:27.000Z
3669,wag nyo gagamitin yang gcash na yan mautak yan naka 600 na ako sa gcash tapos mo pa ung mga nagastos ko na bali ang dami ko na nainvite tanginang yan dko na mabuksan ung acc ko wlang kwentang app yan bulok amphuta tang ina nyo sana mag sara na kayo gago sinayang kolng ung oras dyan sa putanginang app nyo na wlang ka kwenta kwenta napakadaya tapos mag rereply yan dito pag nabasa to sasabihin nya please contact gcash care ghago to ehh dnaman nag rereply ung gcash care langya para sa mga nag ka problema dyan sa acc nila sa gcash wag na kayo umasa na maibabalik yang ng wlang kwentang developer ng app na to ,118,1,2018-02-03T06:47:35.000Z
3671,doesnt reply for verification been trying for a couple of weeks now,12,2,2018-02-03T10:23:28.000Z
3673,bakit po di ako maka kuha nung 200 na load ,10,2,2018-02-03T11:39:09.000Z
3674,new version always got error when access my account dislike,10,2,2018-02-03T13:20:55.000Z
3676,gcash pakiayos naman ng system nyo  madaming nangangailangan ng app na toh tapos ganyan yung system nyo please fix it ,20,1,2018-02-03T18:12:11.000Z
3677,update welp its a good app indeed,7,5,2018-02-04T00:06:19.000Z
3680,the following document untitled document and send to y,9,5,2018-02-04T06:49:58.000Z
3681,this would be the worst app experience you could ever have customer service is not even ok work for it,20,1,2018-02-04T10:18:10.000Z
3682,pano ko po maayos ang account konung nagregister ako unavailable daw tapos pagbukas ko ng gcash nandun na number ko hindi ako makalog in gawa mali daw mpin ko kakainis please help me to recover my account,37,1,2018-02-04T11:16:37.000Z
3685,basura walang matinong pag gamitan nagreregister ako sabi need daw kailangan globe or tm na sim eh globe na nga gamit ko tang ina nyo mapa internet o kung ano man pera pera lang kayo mga gago pero serbisyo nyo palpak time,42,1,2018-02-05T00:46:39.000Z
3687,okay naman to gamitin though sana yung pag verify medyo mas padaliin nyo sana kagaya sa coinsph mga legal documents and id  selfie okay na verified na di na kailangan video call eh araw araw panget ako nahihiya ako syempre kailangan ko pa magpanggap sa harap nyo tsaka isa pa pala yung pag cash in thru coinsph from gcash ispecify nyo talaga kung magkano fee sabi ng dragonpay 10 pesos sa email ganun din tapos mababawas sakin 20 nagreport ako sa dragonpay sabi 20 daw talaga baguhin nyo na para di nakaka insulto,93,3,2018-02-05T04:19:53.000Z
3688,why cant i open my gcash account i cant open it with my mpin,14,2,2018-02-05T05:40:59.000Z
3689,useful yung rebates from load promos,6,5,2018-02-05T09:00:39.000Z
3691,its a perfect app for me and the load rebates is my happiness thanks gcash ,15,5,2018-02-05T10:02:12.000Z
3693,ang daming negative feedbackayusin nyo ang mga bugs pati ang serbisyo nyopera ng user ang nakasalalay ditokaya nga gagamit ng app para mapabilis ang transaction  hindi para lalong tumagal please fix itactually i need this app for my business,39,1,2018-02-05T13:18:15.000Z
3694,ok naman yung apps ayusin nyo lang pag gamit hahaha love it,12,5,2018-02-05T14:09:16.000Z
3695,such a waste of time,5,1,2018-02-05T14:35:32.000Z
3697,incredible service thanks to gcash  having a virtual credit card makes shopping online so simple ,15,5,2018-02-05T15:09:39.000Z
3698,if in malaysia have gcash more better ,7,5,2018-02-05T17:41:10.000Z
3699,bat nabawasan php ko ng 100,6,1,2018-02-05T21:27:01.000Z
3700,malaking tulong ito at nagbibigay ng bonus kaya download ninyo kac napakagandang gamitin ito para mamonitor ang inyong pera,19,5,2018-02-05T23:25:00.000Z
3703,the verification process takes a lot of time even though it already paperless,13,1,2018-02-06T05:23:12.000Z
3705,nalocked gcash ko dahil sa app na to nagchange pass lang ako tas nalocked na anyari dun,17,1,2018-02-06T08:57:49.000Z
3707,i like it and nice app,6,5,2018-02-06T09:56:35.000Z
3708,after update i cannot load my smart what a stupid app,11,1,2018-02-06T11:36:18.000Z
3709,i cannot make an account i want to use it and when i try to register it always says its unavailable  please fix this app,25,1,2018-02-06T16:32:28.000Z
3711,this is the best virtual wallet for virtual admins  free and easy to withdraw funds from paypal virtual and actual cashcards are so easy to use for shopping bills payment and loading funtions much better than other apps way to go globe keep up the goodwork,46,5,2018-02-07T02:56:49.000Z
3712,i rate 5 star its good app but why my referal invite and my amex card free 100 nothing to recieve pls fix it,24,5,2018-02-07T06:24:57.000Z
3713,putang ina tong app na to,6,1,2018-02-07T12:24:00.000Z
3714,what the hell after updating i cant open it  when i try to open its automatically stop gcash fixed your apps,21,1,2018-02-07T17:02:01.000Z
3715,awesome easy to use,4,5,2018-02-08T02:00:37.000Z
3716,useless app cant even log in,6,1,2018-02-08T03:52:36.000Z
3718,please help me i forgot my mpin ,7,4,2018-02-08T19:08:55.000Z
