,review_clean,Word_Count,review_rating,review_datetime_utc
1510,this used to be a very good convenient and useful app until they decided to drop the convert load to gcash feature last february 20 2017 now i dont even want to use this what a garbage in my phone memory indeed and for those who are planning to consult globe store crew or call 2882 about this i highly insist that you dont do it unless youd like to see incompetent and useless outsourced reps to screw up your concern even further what a lousy management globe has indeed,90,1,2017-03-07T15:09:27.000Z
1513,im not sure but i can try,7,4,2017-03-08T10:11:55.000Z
1515,its good for me,4,5,2017-03-09T04:33:39.000Z
1517,sana po ibalik na ung load convert to gcash,9,1,2017-03-10T02:27:02.000Z
1520,im think this is good  im happy that im one of used this app ,14,3,2017-03-10T06:18:24.000Z
1522,cant convert load to gcash useless app smart prepaid is more reliable,12,1,2017-03-10T09:46:51.000Z
1523,super lame the app cant read my globe sim in the sim 2 slot,14,2,2017-03-10T10:04:31.000Z
1524,sorry the load to gcash service is no longer available to fund your gcash you may cashin via any gcash partner outlet nationwide paypal or our partner banks  akala ko pa naman makakapag transfer ako,35,1,2017-03-11T08:17:21.000Z
1525,i loved this app,4,5,2017-03-11T11:19:19.000Z
1526,simula nung inalis na prepaid load to gcash wala n tong kwentang app,13,1,2017-03-12T04:35:38.000Z
1527,useless app without prepaid load to gcash,7,1,2017-03-12T08:36:49.000Z
1532,caanot anymore convert load into gcash this is the only feature of the app that made me download the gcash app better delete the app what a trash,28,1,2017-03-15T11:06:05.000Z
1534,sana ayusin naman nagbayad ako bills gamit gcash its been 5days wala parin makukuha ko pang maputulan ng linya,19,1,2017-03-16T07:32:58.000Z
1535,i want to be a online specialist that is my passion trustee you can count on,16,5,2017-03-16T15:25:17.000Z
1537,it sucks i have been trying to look for an answer to my problem but it seems that they dont have any resolution i cant cash in my paypal to gcash coz incant login to my account i have called their hotline number but there is no way for me to speak to someone for help i will change my rate you fix my problem,65,1,2017-03-17T06:20:07.000Z
1539,i cant transfer my prepaid load to gcash now    tsk,10,1,2017-03-18T00:32:42.000Z
1540,my sole purpose of downloading the app is to send my prepaid load to gcash wallet but then its not working so its completely useless,25,1,2017-03-19T01:39:05.000Z
1541,i am satisfied with the service of globe so far my only concern is that i am being asked to transfer my prepaid sim to sim1 slot whenever i have to access my gcash,34,4,2017-03-19T15:16:17.000Z
1543,realy this thing gonna work,5,5,2017-03-20T14:20:42.000Z
1546,useless app lots of errors they removed other features  instead of adding new features for their new version this app sucks,21,1,2017-03-21T14:32:03.000Z
1547,whats wrong why i cant cash in my prepaid load tsk huszle  i need the old prosses it very easy to us but now aurgghhhh,25,1,2017-03-22T07:10:36.000Z
1548,im using this for my business,6,4,2017-03-22T08:29:21.000Z
1549,does not work on my phone,6,2,2017-03-22T10:43:14.000Z
1550,you can have money and anywhere by gcah,8,5,2017-03-23T04:53:11.000Z
1552,hi gcash why you remove the cash in load to gcash,11,1,2017-03-24T04:40:26.000Z
1554,cant even convert my prepaid load to gcash ,8,1,2017-03-24T10:37:51.000Z
1556,simple and easy use,4,3,2017-03-24T15:26:30.000Z
1557,please add back the cash in using load it doesnt satisy all possible gcash users,15,1,2017-03-25T10:24:48.000Z
1558,nice update sana po ibalik ulet ung load to gcash,10,4,2017-03-25T12:06:33.000Z
1559,hindi ba makalogin after update wth so diappointed,8,1,2017-03-25T14:06:14.000Z
1561,i will experience fs frst,5,1,2017-03-25T16:29:22.000Z
1562,puede sana iupload na lang yun latest at updated version para di na sumakop pa ng malaking memory,18,2,2017-03-25T22:12:23.000Z
1563,gcash load very easy and convenient,6,5,2017-03-25T22:53:49.000Z
1567,login failed after i entered pin code the app is very useful i wish the app developer should work on the fix asap this app is a paymentmoney transfer and business solution  therefore this app should work well and flaws should be addressed immediately by the developer for the convenience of its users and for the success of this great app that makes life easy thanks,66,3,2017-03-27T04:40:18.000Z
1569,this app is crap totally crap,6,1,2017-03-28T14:36:48.000Z
1570,cant link bank account because i cant login,8,2,2017-03-29T07:16:00.000Z
1571,cant download  feeling annoying,4,1,2017-03-29T10:50:12.000Z
1574,bulshet wheres the losd to gcash cash in ,8,1,2017-03-30T01:41:41.000Z
1575,very useful and helpful,4,5,2017-03-30T07:27:11.000Z
1576,theres a glitch when buying a load sometimes no confirmation messages appear it just returned to the amount page the results when trying to click the next button another transaction process will occur,33,3,2017-03-30T11:01:44.000Z
1578,what happened cash in bpi  input pin bank details are blank cannot reload my gcash card,16,1,2017-03-30T15:45:38.000Z
1580,got better with latest update biggest improvement is the login authentication is now only for first login after entering the mobile no it can already make login without authenticating after entering the pin can work now with dual sim without changing globetm as default sms network,46,5,2017-03-31T04:35:15.000Z
1582,very useful app a must have for all mompreneurs ,9,5,2017-03-31T07:36:26.000Z
1583,i usually comment only if either im totally satisfied or im totally pissed with an application and right now im totally pissed gcash doesnt allow me to convert my prepaid load anymore bring back that feature and i will change back my rating to five stars and will even refer gcash to my friends again,55,1,2017-03-31T08:12:09.000Z
1584,i wish the developers could enhance the ui for much better user experience and an option to switch using fingerprints when verifying instead of using pin code because it will be much convenient and much secure by using biometric authentications featured in most high end smartphones,46,4,2017-03-31T08:26:06.000Z
1586,very useful thumbs up ,4,5,2017-03-31T13:04:46.000Z
1587,love the new update kudos to all the developers behind,10,5,2017-03-31T14:17:55.000Z
1588,i suggest i would like to see my linked card securely right within the app im talking about the concept of paymaya i find it convenient when purchasing online thats all,31,4,2017-03-31T16:36:49.000Z
1589,bring back the load to gcash,6,5,2017-04-01T01:17:08.000Z
1590,better update it looks good easier log in,8,5,2017-04-01T02:59:44.000Z
1591,pay bills button is not working i couldnt pay meralco anymore laging error,13,3,2017-04-01T03:44:05.000Z
1592,and the app becomes more secure,6,5,2017-04-01T03:58:43.000Z
1593,theres an option to pay insurance but i always got an error i thought payment would be easy thru gcash but its not this app is a trash,28,1,2017-04-01T09:42:27.000Z
1594,trash gcash app restore the prepaid load to gcash,9,1,2017-04-01T10:06:35.000Z
1596,dear gcash thank you for improving your service hopefully the gcash card will always be available in your business centers ,20,4,2017-04-01T12:45:16.000Z
1597,may problema paypal cash in ayusin nyu yan,8,1,2017-04-01T17:08:06.000Z
1598,with this latest uodate gcash might look better but they focused too much on it my number needa to be registered even thiigh i have been using this before aside from that should i expect that they need to be verified and go though kyc again such a hassle to their customers,52,1,2017-04-02T07:13:20.000Z
1599,glad they fixed this app,5,5,2017-04-02T13:00:39.000Z
1600,please fix and update other bills payment like sss there are still errors when trying to pay for it,19,3,2017-04-02T13:20:42.000Z
1601,bring back prepaid load to gcash,6,1,2017-04-02T14:35:31.000Z
1603,the only purpose this app had for me was the transfer from prepaid load to gcash credits and you took it away,22,1,2017-04-02T23:25:37.000Z
1604,fix the bug suddenly im no longer a gcash user deym after 5years,13,3,2017-04-03T11:12:52.000Z
1605,since the app was upgraded  it wont let me pay to a specific merchant online who accepts gcash as payment i am not receiving the sms notification to confirm payment unlike before  also when ut comes to refunds  i have an existing refund ive been waiting for its been 2 months but its still unresolved,55,3,2017-04-03T14:43:25.000Z
1606,i downloaded the app because of the rumored globe load to gcash function turns out you removed that convenient way disappointed,21,1,2017-04-03T19:07:01.000Z
1607,new ui looks good i always use this to pay my bills,12,5,2017-04-04T06:19:44.000Z
1608,got my account locked instantly thanks,6,1,2017-04-04T09:12:03.000Z
1609,looks exactly like the coinsph app,6,1,2017-04-04T15:20:08.000Z
1610,prepaid load to gcash is so usefulwhy take it away ,10,3,2017-04-04T17:10:46.000Z
1611,why cant i fund my gcash using prepaid load,9,1,2017-04-05T04:28:37.000Z
1612,love the new update have two phones i can now access my gcash with both,15,5,2017-04-05T05:14:35.000Z
1613,enable the prepaid to gcash please fix this thank you,10,1,2017-04-05T11:57:31.000Z
1615,the app looks good the registration is convenient just need to explore the different features to give a more helpful feedback,21,4,2017-04-05T13:35:23.000Z
1616,i just updated and so far the new interface is good and simple especially for the login part where the dual sim issue is no longer a problem thanks for the better app gcash,34,4,2017-04-05T17:18:58.000Z
1620,why did you remove the cash in tab convert globe telecom billing to cash i couldnt find it anywhere on your updated app,23,2,2017-04-07T14:56:49.000Z
1621,gcash ibalik niyo yung load to gcash grabe yung hassle ko papuntang city tapos offline pala anung nangyayari sa service niyo paki balik niyo po yung service niyo kahit may 10 charge ok lang sakin kesa pupunta pako sa wala paki balik niyo sana with in this month paki sabi sa it niyo,53,2,2017-04-08T00:13:59.000Z
1623,cannot pay my bills error message always pops up,9,2,2017-04-08T10:05:54.000Z
1624,bring back the load to gcash,6,1,2017-04-09T01:42:02.000Z
1626,cant convert load to gcash anymore which means i need to go outside,13,1,2017-04-10T12:58:34.000Z
1629,i want to be wise in the  matter of money how to spend and save then for my future,19,4,2017-04-11T21:14:50.000Z
1631,i didnt work at all,5,1,2017-04-12T07:03:33.000Z
1632,i am a gcash user for over a year now and my number prefix is 0927 globe when activating this app it tells me that only globe and tm is allowed duhhhhh,32,1,2017-04-12T07:06:01.000Z
1633,i loved this apps,4,5,2017-04-12T09:41:45.000Z
1634,i love the new version now its easy to send my paypal money to my gcash account,17,5,2017-04-13T16:09:46.000Z
1635,mag lag in lang hirap po kung may opera p,10,2,2017-04-14T03:32:53.000Z
1636,sad that converting prepaid load to gcash is not availablehoping that it will be back soon,16,3,2017-04-14T04:43:31.000Z
1637,please fix your paypal linking,5,3,2017-04-14T08:48:01.000Z
1638,super love the updates easier to load my families even if they use other network,15,5,2017-04-15T04:25:43.000Z
1642,i think this is useful,5,5,2017-04-16T13:43:38.000Z
1644,the only thing globe i like is there net good conectservices very very poortsk tsk,15,1,2017-04-17T03:51:57.000Z
1648,i cant register to the app pls fix it and i will give 5 star,15,1,2017-04-19T08:20:04.000Z
1649,please bring back load to gcash services,7,1,2017-04-19T10:08:09.000Z
1650,very helpful in my online transactions very good job globe  i just wish that u return the load to gcash transaction ,21,5,2017-04-19T15:48:50.000Z
1654,pakibalik po yung load to gcash service nyo please,9,1,2017-04-20T13:57:52.000Z
1656,im just trying to use this if its really good aapps,11,5,2017-04-21T10:20:20.000Z
1659,everything is ok except for one important thing and one of the reasons i loved this app before its upgrade is the online payment its not working now on my various phones please check it out it thanks,38,3,2017-04-22T11:39:04.000Z
1661,i cant verify my account to use paypal please help,10,1,2017-04-23T04:55:30.000Z
1662,i dont know how to usw,6,3,2017-04-23T05:03:07.000Z
1664,putang ina ds app is a hell waste of time and money and theres no live agent in 2882,19,1,2017-04-24T09:15:55.000Z
1665,minsan yung pagload mageerror tapos maya maya papasok din nadodoble load na nasesend rugi nigosho,15,4,2017-04-24T09:29:06.000Z
1666,bring back the old version,5,1,2017-04-24T15:17:34.000Z
1667,i like these apps very muchit easy to use and very exciting,12,5,2017-04-25T06:53:57.000Z
1668,i already stated i trust confident using this app,9,5,2017-04-26T00:07:05.000Z
1670,ibalik niyo si load to gcash please ,7,3,2017-04-26T10:41:38.000Z
1671,i love using it,4,5,2017-04-26T11:57:31.000Z
1672,may saving account kana  may eloading business kpa   no hassle to cash in ang cash out  bitlyfreep50gcash ilovethewayyoupay,18,5,2017-04-26T18:54:20.000Z
1675,i love the new update where no need to use the sim just wifi and youre good to go very accessible and fast transaction i recommend this to all my friends thanks gcash,33,5,2017-04-27T02:05:17.000Z
1678,its okay i love this app,6,5,2017-04-27T08:22:25.000Z
1680,please include load to gcash again para d msyadong hassle pag mag cash in,14,3,2017-04-27T17:13:41.000Z
1681,this app sucks been dealing with their customer service for months now trying to link my paypal account with this crap but they could not do it because of my name suffix which paypal said it should be fine because they only have 3 fields to fill upon sign up still getting nowhere with globe always crap,57,1,2017-04-27T23:32:13.000Z
1682,i dont know what going on,6,4,2017-04-28T04:03:54.000Z
1684,thank you gcash i already received my 50 pesos from joining your promo,13,4,2017-04-28T15:00:56.000Z
1687,great and very usefulthanks gcash,5,5,2017-04-29T04:17:35.000Z
1688,please bring back the load to cash feature,8,1,2017-04-29T07:48:38.000Z
1689,just registered para lang sa paypal but hindi makaconnect 2 numbers na ginamit ko wala padin i called paypal they said wala daw problema naka link naman sa preapproved payments tried going the globe shop ok na daw pag uwi ko wala padin tawag ako sa gcash need daw 100 pesos to link with paypal eh wala naman instruction na ganun paikot ikot na ako wala padin hirap,68,1,2017-04-29T10:27:00.000Z
1690,how come it wont take my mobile number and keep saying its invalid but if i use 143 everything works fine please fix this latest update still doesnt want to accept my number,33,1,2017-04-29T11:46:55.000Z
1691,new updation pero hindi parin magamit ang bills payment gcash paki ayos nmn agad toh monthly dues ko kc nkasalalay sa gcash,22,1,2017-04-29T14:57:41.000Z
1692,il give you what i think this is a terrible app i am registering when i set my mpin stupid mpin it said oops theres seems to be a problem p fix this,33,1,2017-04-29T18:19:35.000Z
1693,it keep doing 64 but im in the us and that is a 1 have to fix this,18,1,2017-04-30T06:50:18.000Z
1696,prepair load to gcash is no longer available we might consider doing business with gcash again once this feature will be back,22,1,2017-05-01T07:03:10.000Z
1702,to all filipino citizens i would not recommend this app  the main feature of this ap is already removed prepaid load to gcash this is pretty much 100 useless app now dont bother to waste your time with globobo services it will just give you an head ache im 100 sure of that it will just make your life more complicated  gcash is trash i suggest change to paymaya or smart services dont even try to test them just like i said gcash is trash,85,1,2017-05-05T13:56:12.000Z
1703,cant register haha watta nc service i know this apk will not giving attention to this message i dont want to install this apk anymore,25,5,2017-05-05T14:40:58.000Z
1704,sana po malagyan nyu rin po ng abs cbn at cherry sim ang list ng gcash load salamat po para pang business talaga sya salamat po,26,4,2017-05-06T06:06:41.000Z
1705,pls fix the cash in thru paypal option the currency selection is not appearing so when i just input the amout i want to cash in it will error pls fix this asap thanks,34,2,2017-05-06T07:20:52.000Z
1710,how can i convert my cellphone load to gcash,9,3,2017-05-09T06:42:02.000Z
1711,delayed transaction especially when you need it the most,9,1,2017-05-09T16:38:35.000Z
1713,everytime i register and put a pin they say please try again please fix it,15,1,2017-05-10T02:11:15.000Z
1714,useful iys very useful,4,4,2017-05-10T15:33:46.000Z
1715,pleasebring back the prepaid load to gcash servicesthank you,9,1,2017-05-10T15:47:31.000Z
1718,integrated with beep and convertinh prepaid load to gcash is what i want the most,15,5,2017-05-11T09:00:40.000Z
1720,bring back convert load to cash thats the reason why ive signed up for this,15,3,2017-05-11T13:05:39.000Z
1721,great design except the paypal linking option isnt working,9,3,2017-05-11T17:21:45.000Z
1722,test first before grabing,4,3,2017-05-12T00:29:34.000Z
1724,bring back prepaid load to gcash  ill give you a 5star gggrrr,12,1,2017-05-12T04:01:23.000Z
1725,invalid your face and family,5,1,2017-05-12T04:27:39.000Z
1726,prepaid load to gcash pls,5,1,2017-05-12T14:37:40.000Z
1728,please stop claiming with gcash the life will be easy and convinients its totally opposite you better close ths app espeacially customer hotline 2882 it doesnt help sucks,28,2,2017-05-12T19:09:00.000Z
1729,globe gcash kelan mo ba ibalik load to gcash if not you better erase this app on playstore just a waste of time and data like your trash grewards app aw what can we expect for such a greedy money eatiny business you never care to your subscribers like the call center agents of globe stupid and arrogant,58,1,2017-05-13T00:40:54.000Z
1730,hassle method already linked my paypal but needed to link again to transfer funds,14,1,2017-05-13T05:03:23.000Z
1731,why i cant cash in through paypal i already linked my gcash to paypal,14,1,2017-05-13T07:29:00.000Z
1732,problem with linking to paypal seems like paypal isnt recognizing gcash so paypal is automatically deactivating the preapproved payment fix it please,22,1,2017-05-13T10:04:22.000Z
1734,useless even if youre kyced already cash in wont work ive been trying to cash in some funds but gcash wont let me logged out logged back in uninstall install unlink relink but still not working ive called everyone there is to call but no use ive exhausted everything but this app is such a waste of time i been doing this for hours then i realized it consumed almost my whole day and still not able to cash in my day became so unproductive because of this app its useless very useless,93,1,2017-05-14T13:56:50.000Z
1736,cant link paypal here ive tried 7 times linking my paypal account here but i didnt received any confirmation nor does it confirm,23,1,2017-05-15T05:10:48.000Z
1738,paypal to gcash cashin has been unavailable since 10th of may i contacted the gcash hotline last 12th of may and they said that the problem is with paypal and theres no expected turnaround time i still gave them a good review afterwards eventhough the problem isnt sorted out yet because i understand that it isnt globes fault 14th of may i tried linking my paypal to gcash again and it went through however everytime i click cashin it says that i need to link my paypal acct eventhough i already did i contacted paypal to listen to their side and they said that the integration for preapproved payments to gexchange has already been sorted so now the problem is with globe im really disappointed that its taking so long to sort this issue the only reason why i used gcash and even took out a mastercard with globe is because i get paid by clients thru paypal and gcash is the most convenient way of withdrawing those funds now i have all the funds in paypal without being able to withdraw it and im losing freelancers since i am unable to pay them this is really bad for business as soon as i find something else that offers similar service ill cut my ties with globe and get rid of gcash my 50mbps internet subscription and wont renew my postpaid plan anymore i am sick and tired of dealing with a company that promotes nothing but headache to consumers i am so done with globe,256,1,2017-05-15T20:23:40.000Z
1742,good app for me,4,5,2017-05-16T12:34:20.000Z
1743,i like this app,4,5,2017-05-17T06:59:31.000Z
1744,it should have a prepaid load to gcash conversion,9,2,2017-05-17T11:47:10.000Z
1745,takes ages to process loads,5,1,2017-05-17T12:39:39.000Z
1749,mabait mapagmahal sa anak at asawa,6,5,2017-05-19T04:14:26.000Z
1750,paypal to gcash not working,5,3,2017-05-19T09:47:44.000Z
1752,still no dual sim support but love the new approach its way better and more secure than the old update,20,5,2017-05-19T18:02:15.000Z
1753,paypal cash in does not work ever,7,1,2017-05-19T18:42:16.000Z
1754,i tried to register many times and still its giving me an error,13,1,2017-05-19T22:08:34.000Z
1755,i cant use paypal to gcash its been days ago,10,3,2017-05-20T03:02:54.000Z
1756,most 5 star reviews here are fake ,7,1,2017-05-20T07:50:26.000Z
1760,their service just brought me a lot of pain hassle and inconvenience rather than convenience i have been using gcash for more than two years but now i am ending it due to poor service and faulty system  negatives 1 i do not recommend to use this service for shopping online it will just bring you a lot of hassle due to the following reasons    a creditsrefunds are not automatically added to your account you have to call their hotline for that refund and ask you to fill up and sign a dispute form     b most purchases although the amount has already been deducted from your account are unsuccessful and will just cause you to have problems with your orders online  2 if there are credits or adjustments related to your purchases or subscriptions those adjustments will not reflect to your account automatically therefore you will have to really monitor your transactions happening in your gcash account which i think will just provide me a lot of hassle and additional work  3 buying loads with other networks only work sometimes and not all the time,185,1,2017-05-22T05:54:57.000Z
1762,very good app and useful safe,6,5,2017-05-22T12:26:56.000Z
1766,very helpful and useful,4,5,2017-05-23T08:27:20.000Z
1771,so far so good wala akong masabi  thanks gcash for having this app sana sa next update available na lahat ng mga load denominations sa buy load sa lahat ng network para astig looking forward of this ,37,5,2017-05-24T08:58:08.000Z
1775,should be no charges for encashment,6,1,2017-05-25T00:34:46.000Z
1776,may 25 update paypal to gcash is already working changed rating to 5 stars hope the service continues thank you,20,5,2017-05-25T14:09:28.000Z
1777,since paypal to gcash is now up and running i have a higher rating but please dont let that happen again its time consuming please globe do your job right,30,4,2017-05-25T14:20:26.000Z
1779,i like it nice app,5,5,2017-05-26T06:43:22.000Z
1780,i am new to gcash whenever i register it keeps showing error so i used the 143 and it worked when i tap pay bills it also keeps saying error i tried it with two different devices and it keeps saying the same error i wanna try this gcash service  please fix these things thanks,55,2,2017-05-26T13:10:21.000Z
1781,gcash is very helpful by all means love gcash,9,5,2017-05-26T14:52:37.000Z
1782,wow its vry good app real paymentss in this app,10,5,2017-05-26T16:14:27.000Z
1788,when i try to use the pay bill optionanything from itit always show error code bfa3,16,3,2017-05-27T14:39:26.000Z
1789,since load to cash was disabled gcash app gets useless  please globe yun na nga lang yung madalas magamit inalis nyo pa  kung pwede naman ibalik paki balik then ill change my rating,33,2,2017-05-27T18:48:37.000Z
1790,i cant get my money,5,1,2017-05-28T00:32:39.000Z
1791,it would be great if you its have prepaid load to gcash,12,2,2017-05-28T02:56:07.000Z
1792,better than the best apps,5,5,2017-05-28T03:54:11.000Z
1795,love this app very usefull,5,5,2017-05-29T04:46:12.000Z
1799,the only feature that i use for this service is converting prepaid load to gcash for online transactions since they already removed that feature uninstalled,25,1,2017-05-29T20:09:37.000Z
1800,is this gonna give me robux,6,5,2017-05-30T08:41:15.000Z
1802,very useful buying load sending money and of course in app purchases in my games hehe ,16,5,2017-05-30T15:11:53.000Z
1803,why did you remove the load cashin feature why,9,1,2017-05-30T18:23:07.000Z
1805,best app bilis mag cash in dami pang gamit online thanks gcash,12,5,2017-05-31T02:46:37.000Z
1807,nice sana manalo ako,4,5,2017-05-31T16:09:51.000Z
1814,i will try this apps,5,5,2017-06-01T09:19:05.000Z
1820,is there an adroid required for gcash or you can use it on any phone,15,2,2017-06-02T10:53:24.000Z
1821,i love the promo on loads ,6,5,2017-06-03T02:29:52.000Z
1822,i wish there is an option to convert from globe prepaid load to gcash in cash in,17,1,2017-06-03T07:52:34.000Z
1825,cant register stuck on verifying mpin,6,3,2017-06-04T01:28:31.000Z
1826,so we can buy minecraft thats why i installed this app,11,5,2017-06-04T02:19:19.000Z
1833,1 star 4 being ignored me  omg ang dmi q ng msg sa fb pro no one respond  nakakaloka   bkt til now nd q pa rin sya magamit sa paypal q   i mean nd q sya mah ilink,38,1,2017-06-05T01:39:51.000Z
1839,tangina puros ads nakukuha ko eto lagi lumalabas putangina globe,10,1,2017-06-06T10:54:43.000Z
1840,the way to put your popping ads is very unfairly  not a proper way to do marketing,17,1,2017-06-06T14:16:43.000Z
