,review_clean,Word_Count,review_rating,review_datetime_utc
0,works fine i like the graphics and layout wish there was an sms version though,15,5,2012-03-26T05:49:59.000Z
1,unknown error occurred always popping up never been able to login properly,12,1,2012-03-26T10:49:57.000Z
2,very convenient to use,4,5,2012-05-08T03:32:34.000Z
3,it would really be great if you add payable to android apps so it would be easier for android users to buy paid apps who dont have any credit card,30,4,2012-05-31T13:53:30.000Z
4,its working fine with my motorola droid razr yet i think the login should specifically specify that the mpin is needed but overall it works great easy to load easy to pay bills,33,5,2012-06-20T13:38:43.000Z
5,running cm9 on my galaxy nexus plus and keeps crashing when i submit registration,14,1,2012-06-25T16:10:31.000Z
6,love the way you pay,5,5,2012-07-02T14:10:54.000Z
7,ill try if itworks,4,3,2012-07-03T22:34:46.000Z
8,for those qwerty android phones samsung galaxy pro the screen doesnt adapt too well and is shown sideways regardless of the autorotates state onoff  still no bank to gcash feature,30,2,2012-08-17T07:29:38.000Z
9,godd app hope u also create one for windows phones,10,4,2012-08-18T23:44:10.000Z
10,would be nice if globe would allow us to convert prepaid load into gcash,14,1,2012-08-19T02:11:41.000Z
11,good app nice work globe,5,5,2012-08-21T11:07:55.000Z
12,this is an excellent app the ui is very simplistic and very intuitive no frills no confusing menus  just the bare necessities,22,5,2012-08-22T13:28:16.000Z
13,finally an app that eliminates the manual typing of codes for gcash transactions im sure globe will improve the app over time but right now it does the job so kudos to the devs,34,5,2012-09-12T03:09:00.000Z
14,if gcash could b used to buy apps from gplay it would b a great app please,17,3,2012-09-23T14:11:36.000Z
15,much easier transaction thank you globe your simply the best,10,5,2012-10-10T14:33:05.000Z
16,very few merchants are supported the ones i need are either not supported or still buggy i go for smartmoney at the moment,23,1,2012-10-23T22:20:54.000Z
18,i can now finally enjoy shopping online using gcash,9,5,2012-11-20T13:00:21.000Z
19,the qr code generator is amazing super useful,8,5,2012-12-07T00:53:12.000Z
21,this system is so strange i am not filipino but i live in philippines in my country we dont have mothers middle name and when i insert na it doesnt work,31,1,2012-12-18T03:58:51.000Z
22,what im using is my samsung galaxy mini for sending money but whenever i use this application and about to send the money it crashes like always i had never used this application to any transactions because of that problem please kindly fix it so that this application will be useful,51,2,2012-12-21T09:07:58.000Z
24,registered then send request forever in login,7,1,2013-01-08T01:00:10.000Z
26,very accessible for the online buyers like me thank u globe for upgrading gcash more power,16,4,2013-02-26T03:48:56.000Z
27,yah  i wish it can be use on playstore,9,5,2013-02-28T12:51:35.000Z
28,most of mobile phones in philippines are dual sims its hassle to swap sims everytime using it can only use it if you have internet connection,26,1,2013-03-01T07:52:01.000Z
29,why i cannot use my virtual card charge to my gcash postpaid account error always occure been calling your hotline many times but no update from your end cmeon guys please do something,33,1,2013-03-03T00:14:49.000Z
30,been using the app for a while now and i must say how it helped me manage my gcash account great job from globe,24,5,2013-03-05T22:09:29.000Z
31,app is very slowwwwww,4,1,2013-03-07T11:26:03.000Z
33,nice apps  makes payment easier but major downside is bpi credit card not in the lists how come its sister company not on the list,25,1,2013-03-15T07:32:50.000Z
34,very nice interface and does the job well,8,5,2013-03-17T00:28:35.000Z
35,it stopped working it told me to call 2882 is it because of the kyc ive already registered to kyc,20,3,2013-03-17T02:45:16.000Z
36,if it is internet based why is there still a need for mobile load for it to work for checking gcash account porpuses indeed mobile balance is needed in sending money through gcash but checking for account balanceinfo only i think is not necessary if this app is internet based,50,3,2013-03-20T01:26:38.000Z
37,thanks for advertising for gcash bcoz i cant buy via online shop if u dont have creditcard so thanks for this app and gcash amex virtual card and i hope it will convinient to me thanks,36,5,2013-03-21T19:34:19.000Z
39,you dont have to move your sim to slot1 just disable sim1 while youre using gcash app,17,4,2013-04-21T09:30:37.000Z
40,i am registered to gcash but when i applied for my amex it gives a message saying i am not register to gcash i have also done the kyc at globe center,32,1,2013-06-19T06:42:09.000Z
41,we want to purchase stuff in the play store using gcash make it happen and you guys will rule,19,3,2013-06-29T12:05:56.000Z
42,says unable to process uninstalling it now,7,1,2013-07-02T22:29:10.000Z
45,every time that i access my gcash using this it always deducted in my load i dont know why,19,3,2013-07-30T10:56:10.000Z
47,why is it requiring me to have prepaid credits before i can login what if i dont have any and i need to get some credits from my gcash id have to go to a store to buy prepaid credits just so i can login to gcash isnt this service suppose to be about convenience please fix this until then im uninstalling,62,1,2013-08-03T01:47:51.000Z
49,the app became smoother and the animation has improved the overall user experience thanks for the update,17,5,2013-08-15T15:38:43.000Z
50,i hope it could be used as a mean of payment in android market ,14,1,2013-08-20T07:49:56.000Z
53,a lot of improvement but why is the outlet locator module crashing,12,4,2013-09-27T02:37:09.000Z
54,but slow and crashing,4,5,2013-09-27T08:26:14.000Z
55,great job efficient and nice skinning,6,5,2013-09-30T20:01:43.000Z
56,very useful application covenient on paying bills and sending money  good job on the weekly transaction history its easier to budget your gcash,23,5,2013-10-01T02:19:29.000Z
57,the app crashes when checking the debit credit transaction history,10,2,2013-10-01T15:42:39.000Z
58,gcash app is in good direction i hope developers can add nfc features also a list of participating stores for the qr code feature the apps resolution is quite fuzzy at some parts though,34,4,2013-10-01T16:12:41.000Z
60,i love this app but why is there only one favorite for each category i pay 3 accounts using one category and i would love to not reenter them all the time would give 5 stars if you change please do something about it thanks,45,2,2013-10-03T05:27:51.000Z
61,i cant open my account since the last update ,9,1,2013-10-03T16:43:48.000Z
62,now i can purchase apps and games on play store via globe gcash,13,5,2013-10-04T03:13:05.000Z
63,very nice app it will be more convenient to those who has a gcash account and also i like the new color,22,5,2013-10-04T08:19:03.000Z
64,still the easiest way to check your gcash balance and the addition of having a log of recent transactions in the app itself was a welcome and much needed addition unfortuantely transaction history requests were broken in the last update heres hoping that in addition to the emailed report the ability to query and view ones full transaction history will be added to the app itself in the future  also maybe give the app more holo love it looks a bit too iosgingerbread,83,3,2013-10-07T10:36:16.000Z
65,the new interface is nicely done its cleaner and more intuitive than the previous version its also nice to see the gcash outlets map and updated faqsturotials this app is the only thing ill ever need to maintain my gcash account   i would also like to commend the team for its excellent support on my issue before regarding the log in problem thanks for the fast update and resolution,69,5,2013-10-11T18:05:41.000Z
66,cool ui but more importantly fixed the login issue,9,5,2013-10-12T05:36:05.000Z
67,gotta say i love the new update  easier and overall it really looks nice a complete departure from the last bluish look version,23,5,2013-10-13T05:09:38.000Z
68,hassle freetanks globesmart people are using globewink,7,5,2013-10-13T16:11:16.000Z
70,before i switched phone gcash app is working flawlessly but now after transferring my sim to a new phone with updated application it is stuck on sending request prompt please any help will be much appreciated,36,1,2013-10-31T13:36:01.000Z
71,i switched my sim cards like you said and now it works thanks so much for your help looking forward to using this app   ps excellent customer service so helpful polite and quick to respond,35,5,2013-11-09T05:58:28.000Z
72,since it webbased it should at least login thru web and no need to send request using 2882 automaticaly wc requires globe sim to be inserted what if i use tab or smartphone that has diff sim or no sim at all but has wifi,45,1,2013-11-29T11:54:23.000Z
73,everythings smooth and i love the ui however gcash locator force closes,12,3,2013-11-30T03:56:34.000Z
74,if ur using dual sim phone try to make the globe sim the default one or put it in the sim1 slot or remove the other sim first so it can send message to the globe network thanks cs for helping me,42,5,2013-12-01T07:33:31.000Z
77,greatly improved ui with a more polished look recommended for onthego globetm subscribers,13,5,2013-12-19T15:17:12.000Z
78,great ui and very responsive unlike gmessage which requires a lot of attention at the moment all in all a functional app  which just reminded me to get kyced for amex haha please get rid of the ads though it kills the apps supposed to be charming neatness,48,4,2013-12-22T06:45:51.000Z
80,maganda ang pagkagawa ng app and nice ui thanks globe,10,5,2014-01-09T04:43:52.000Z
81,you can topup your globe gcash using 119 bpi menu on globe sim but fist your globe sim must be link and activated via bpi atm machine,27,5,2014-01-12T07:25:57.000Z
82,very useful app for my android device please make a version for windowsphone 8 so i can use this anywhere thank you,22,4,2014-01-15T03:54:49.000Z
83,great applicationi hope there is a menu tab for gcash loading and transfer to bdo bancnet and paypal and vice versa,21,5,2014-01-20T15:18:12.000Z
84,excellent app very useful for gcash users,7,5,2014-02-03T10:51:06.000Z
86,how can i use this to buy apps  google play store,11,5,2014-02-08T14:46:26.000Z
87,so apparently you cant access your gcash if you dont have any prepaid load so much for using gcash to buy your own load 5 stars if this gets fixed,30,2,2014-02-12T02:43:27.000Z
88,at first this s so good but the second time i tried to log in it kept saying that my pin  is incorrect so i tend to repeat the whole thing until it blocked me going to globe center is so stressful so i just changed my number i tried to log in but it forced close til now it doesnt allow me to log in what does this do in the first place this isnt helpful that much or at all,82,1,2014-02-14T12:55:55.000Z
89,nice app nice ui clean and fast  ,7,5,2014-02-20T11:41:14.000Z
90,how can i use this app to buy  games on google play,12,4,2014-02-20T14:04:09.000Z
92,great app from globe what a wonderful world i am able to pay my bills and buy airline tickets using this app thank you globe,25,5,2014-02-26T13:50:49.000Z
93,pls complete section of goverment biller eg pagibig,8,3,2014-02-27T14:09:57.000Z
96,pag mag login ako we are unable to aunthenticate you make sure you have entered your mpin correctly would you like to retry tapos sinesend sakin through sms sorry u sent an invalid command to get a list of ur subscriptions on 288 at kung pano magoff snd check to 288 for free snd keys for other svcsp250msg nag try rin ako mag register sa app ayaw din pero pag browser nakakalogin ako at nakapag kyc na ko paki fix thanks,81,1,2014-03-09T14:02:17.000Z
97,this is very useful for gcash transaction,7,5,2014-03-13T15:28:39.000Z
99,serves its purpose love it,5,5,2014-03-25T00:59:46.000Z
100,still cant use this uninstalled,5,1,2014-03-29T10:48:47.000Z
103,after installing the update its not letting me login i get an error that says they cant authenticate me,19,1,2014-04-11T09:57:26.000Z
104,very poor  theres no service and it keeps on telling me to try again later   its sucks ,17,1,2014-04-15T00:29:37.000Z
105,nandto aq s saudinagregister aq s gcashmy load aqng 25pesos s roaming kinain lng pro ndi aq nkpg log innag register dn aq ng gcash s globe bago q iopen ung gcash s cp pro walang nangyarikinain lng load qano b tohlokohan,42,1,2014-04-16T10:37:59.000Z
106,adding the cash in thru bpi makes this app more reliable before i have to make other process to do this but now its in one app keep up the good work i hope you can add more convenient feature,40,5,2014-04-17T08:09:07.000Z
107,pls help me i can registed ask me to call hotline yi have gcash already im here at singapore pls do help me thank,24,2,2014-04-24T06:02:01.000Z
108,now with bpi for faster transaction ,6,4,2014-04-27T06:13:19.000Z
109,good but improve more,4,4,2014-05-03T23:32:36.000Z
110,i cannot log in,4,1,2014-05-05T06:15:25.000Z
111,di po nagaaccept ng less than 6 digit na pin sa bpi to gcash tapos nag cacrash kapag sinelect yung biller sa pay bills,24,1,2014-05-14T11:49:29.000Z
112,how to  to buy play store apps please help me,10,2,2014-05-23T12:49:40.000Z
114,be great if the sms registration confirmation ever arrived but it did not so 1 star as useless,18,1,2014-05-25T21:33:43.000Z
116,the app wont open  whats wrongpls help i am currently using a powerplay number issued by a company,18,1,2014-05-31T12:49:53.000Z
117,i cant register to the american express virtual pay,9,3,2014-06-03T04:00:26.000Z
118,i cannot log in after entering mpin it always say sorry we were unable to send a message please call the gcash hotline at 2882 for assistance and when i called your hotline they dont even know how to solve my problem please fix this,45,1,2014-06-03T08:10:52.000Z
119,team thanks for fixing the buy load service   br kaglobe,10,5,2014-06-08T16:55:11.000Z
120,the confirmation message keeps telling me im  already registered how can it be this is my first time downloading this app,21,1,2014-06-16T14:54:43.000Z
121,hi can i use my student id for kyc thnx ,10,5,2014-06-16T17:48:28.000Z
122,ang sungit ng nagreceive ng call ko at wala pang na2long grabe ng sinasabi wala naman sense sana po gwin nyo nmn accommodating ang csc nyo,26,1,2014-06-18T06:58:45.000Z
123,whats wring witg this app cnt even install it,9,1,2014-06-18T07:40:19.000Z
124,installed this app on both ios and android faced several issues 1 takes too long to register 2 2882 is not very helpful who ever thought of having to many useless ivr options that not even lead to speaking with someone should be fired 3 saying already registered but did not get ajy confirmation hence account got locked and calling 2882 is useless,63,1,2014-06-20T20:51:00.000Z
126,sana lahat ng makikita sa ussd via 143 makikita at nauupdate agad sa app para di na hassle sa dialing ng ussd service like pag ibig payment wala yun sa app,31,1,2014-06-22T09:07:14.000Z
127,hi m using a dual sim fon i wrongly used my 2nd sim which is not my gcash sim wen downloading ds app and used in my registration how can change my registration numbrmy gcash numbr pls help,38,3,2014-06-24T04:58:41.000Z
128,wish there is a way you can transfer your cash from your gcash to your bank accnt,17,5,2014-07-12T18:16:03.000Z
129,it was working fine before why the change now i cant log in,13,1,2014-07-14T03:53:18.000Z
130,5 stars for you please continue adding features,8,5,2014-07-17T09:46:23.000Z
131,cant even sign in,4,1,2014-07-28T13:55:47.000Z
132,i lovr the way i used it,7,5,2014-07-28T23:37:31.000Z
133,hi globe sorry im new to these kinds of transaction would just like to ask why is it that when im trying to purchase using amex it prompts that it is declined,32,3,2014-08-02T09:53:32.000Z
134,request kindly enhance the bills payment facility please enable saving frequent billers though you already have favorites  i can only add 1 account per biller in my case i have 2 credit cards under one credit card company but currently i can only add 1 card account per credit card billershould allow multiple cards per billerthanks,56,5,2014-08-02T12:51:19.000Z
136,still no pagibig fund in 220in sms based  its available,10,3,2014-08-12T12:35:02.000Z
138,downloaded it but i cant even sign in it just stops once i enter my pin and now i updated the app but still to no avail,27,1,2014-08-14T03:36:43.000Z
139,sending transaction failure always,4,1,2014-08-16T00:56:02.000Z
140,have not experienced  any problemso far,6,4,2014-08-28T13:53:12.000Z
144,works great  snappy response and good ui allows cashing in via your bpi account also liked the favorites tab when sending load update can now send load to other networks great app overall  good job globe now if only you can fix the gservices app,45,5,2014-09-02T22:05:06.000Z
145,nicekeep up the good work and keep adding new features soon,11,5,2014-09-07T17:48:28.000Z
146,is it correct now i can buy load for other networks,11,5,2014-09-08T04:46:12.000Z
148,when i try to buy load for my contacts it crashes as i type in the name,17,4,2014-09-09T15:46:25.000Z
150,so i could use this for iap,7,5,2014-09-12T18:15:26.000Z
151,can i pay my bills to bpi using gcash thanks,10,3,2014-09-13T12:13:43.000Z
152,d ko po mainstall  d ko po nalalagyan ng pera gcash ko,12,2,2014-09-15T03:57:07.000Z
153,hi i tried to load 50p for smart users and it takes too long to credit sometimes it doesnt credit and will returned to my balance when it credited it doesnt give me a 10 rebate but when i loaded 15p for globe it gives me p090 rebate oh i get it there is no rebate when u load other networks than globe,63,3,2014-09-17T02:15:55.000Z
155,how to unlock my gcash account,6,5,2014-09-17T19:55:50.000Z
156,it doesnt support my jb 412 device useless,8,1,2014-09-25T09:30:24.000Z
157,could it be used to transact with google playstore,9,5,2014-09-26T13:41:56.000Z
158,everything is very amazing with globe keep up the good work i really loved it,15,5,2014-10-03T12:35:16.000Z
159,please add feature to buy  supporter on osu,8,5,2014-10-06T14:53:34.000Z
160,so good so reliable,4,5,2014-10-10T06:53:46.000Z
164,needs to send a text just to log you into the application stupid goes to show globe cant do anything right except for steal money from their customers,28,1,2014-10-23T11:31:31.000Z
165,can i buy apps in app store using g cash ,10,5,2014-10-25T13:19:34.000Z
166,works as stated easy to use and thumbs up for the ui though i suggest you should have an option or feature to transfer gcash to bank like bpi acct ill reserve my 5 stars for that this version is good enough hopefully though security comes first oh one more thing i guess try to integrate the trnasaction history atleast from the last 7 days sending it to email is not friendly tip see bpi app for sample,78,4,2014-10-30T23:42:25.000Z
168,cant login asking for a peso load seriously  i am out of the country and need to pay something to a merchant in the ph  stupid requirement,27,1,2014-11-01T14:38:22.000Z
169,i love this apps and i love globe,8,5,2014-11-02T10:21:30.000Z
171,app is gudbut one thing is my concern this app should not rely on one phone numbersshould have an option to access gcash using existing accountonce open this appit sending an sms command to network which is not posible due to my one celphone is in other networkplease improve by nxt update of this apptnx,55,2,2014-11-04T15:06:59.000Z
172,wont let me register and the hotline doesnt work so this app is a useless piece of junk on my side,21,1,2014-11-08T22:56:55.000Z
174,how to change load to gcash so i can buy google play app games,14,3,2014-11-12T18:17:27.000Z
175,password is not matching into the document attached,8,5,2014-11-15T04:07:47.000Z
177,and still they dont answer u lol,7,2,2014-11-17T19:11:19.000Z
178,very convenient love it,4,4,2014-11-18T00:41:46.000Z
180,i thought it will work once you are connected to the internet like wifi hindi pala kelangan globe pa din yung sim sa phone ano ba yan,27,1,2014-11-21T10:51:15.000Z
181,this app is just perfect super secure at napaka user friendly just when i though that globe cant do anymore better i found this amazing app  grabe free na nga amg sending ng money through gcash napaka convinient pa di talaga pwedeng ipagpalit the best parin talaga  keep the best service globe,52,5,2014-11-21T11:40:59.000Z
182,why is it so hard to log in the error keeps popping saying there was an unknown error blah blah even tho i have a stable internet connection and it freaks me out globe pls fix this huhu,38,2,2014-11-22T06:54:36.000Z
187,thanks to all globe owner and sttuff,7,5,2014-11-29T13:12:11.000Z
188,give some faster and new promos and services,8,3,2014-12-01T05:05:05.000Z
189,cant download and install the app  error 923  may space nman storage device ko,14,2,2014-12-01T06:55:11.000Z
191,doesnt seem possible  either because im overseas ie roaming or globe sim is in slot 2 au phone sim has to be in slot 1 great feature if it works too bad,32,1,2014-12-02T19:44:20.000Z
192,need an app for windows 8 phone pls,8,1,2014-12-04T05:53:44.000Z
194,i was charged twice for a transaction i didnt know that the next button meant to be charged again i thought next would be for next transaction,27,1,2014-12-06T04:58:47.000Z
195,so far its ok but relog in every 10mins ok bearable but 15 service charge lugi sa business ang laki ng patong,22,2,2014-12-10T01:52:21.000Z
198,keep it up im using this 3 months ago and very smooth transaction looking for new service,17,5,2014-12-18T01:10:57.000Z
200,love it mwah hope u have points rewards apps to load po tnx,13,5,2014-12-29T04:09:10.000Z
201,please fix it thanks,4,3,2014-12-31T04:05:31.000Z
202,sim must be on sim 1 and its not working after i logged in very frustrated developers pls fix the issue on logging in and dual sim its useless if users cannot log in,34,1,2014-12-31T13:09:30.000Z
203,im new to globe gcash so after installing this app i was hoping it would work i cant login to my account even if i entered the correct pin apps like this should be helpful and handy but with this app its frustrating,43,1,2015-01-01T09:55:58.000Z
206,i tried to use the prepaid load to gcash feature it worked between the first two steps but i did not receive any confirmation sms that it promised to send me my load balance wasnt affected tho i guess it didnt work how do i fix this,47,3,2015-01-04T16:07:56.000Z
207,you only have 1 bank option to transfer cash if you only have more than 1 eg bdo metrobank  etc then i would give 5 stars,26,3,2015-01-05T07:40:06.000Z
208,bakit hindi connected ang globe telecom sa playstore gusto ko sana bumili ng gems sa coc plz help me,19,5,2015-01-06T07:40:02.000Z
209,i tried using this app  it will not work for me because my globe sim is on the second sim slot  it took me a while to figure it out that the app assumes that the first sim is the correct sim to use    it will not work for me because i will not switch my sims around just for this app,62,1,2015-01-09T12:43:01.000Z
211,american express virtual card is awesome,6,5,2015-01-22T13:10:18.000Z
212,easy for me to reload again but is there some way to access it without   a single balance,18,3,2015-01-26T11:41:49.000Z
213,so after i input my pin and then press login it gets stuck on sending request then a notification would pop saying that i need to at least have one peso load im on postpaid this app was great until the last update still occurring and yes i use wifi,50,2,2015-01-30T07:02:05.000Z
214,so easy to use fast transactions very convenient i love it  i have no problems with it so far ,19,5,2015-01-31T14:40:40.000Z
216,so sad not compatible to my samsung tab s,9,1,2015-02-05T17:00:10.000Z
217,i cant log in to the gcash app when im using a wifi connection its saying that i need to have atleast one peso balance to use the service tried using the data connection and it works ok hope the developer will fix this app glitch,46,2,2015-02-16T07:49:23.000Z
219,gud eve how to convert from prepaid airtime load to gcash cashin please reply asap thank you,17,5,2015-02-18T13:32:02.000Z
220,maybe it was because we have poor signal for globe here anyway ive uninstalled it,15,1,2015-02-20T16:04:03.000Z
221,i cant register why i already called your hotline,9,2,2015-02-23T09:49:06.000Z
222,i was going to buy a game in google but it wony purchase please help me,16,5,2015-02-25T07:28:55.000Z
223, this app helps a lot of people ,7,5,2015-03-03T15:29:48.000Z
224,please include other bank like pnb so that i can link and transfer funds,14,4,2015-03-05T14:00:25.000Z
228,best app for globe,4,5,2015-03-13T11:05:55.000Z
231,i can now cashin my prepaidload,6,4,2015-03-16T07:48:23.000Z
233,bumili ako ng diamond sa dot arena pero nde ko naman nakuha pero nakalagay dun na purchased ko na why is that,22,1,2015-03-19T13:34:37.000Z
235,cannot cash in from bpi for a very long time now,11,2,2015-03-20T02:11:53.000Z
237,to create a new account is always wrong,8,2,2015-03-21T10:20:38.000Z
238,used to work but now its not sending gcashbload to my family please fix last trnxn and credit shows unavailable always,21,2,2015-03-22T02:30:07.000Z
239,the app must not require mobile load since it is online i need my prepaid load for emergencies please fix it uninstalling it now,24,3,2015-03-23T12:35:05.000Z
240,and it eats too much of your load 15 fee is too much make it something like a fixed fee like 2 pesos or 5,25,2,2015-03-24T04:00:53.000Z
241,not allowing me to login on my accounteven thoughim already connected to wifi please fix this issue,17,1,2015-03-24T09:55:24.000Z
