,review_clean,Word_Count,review_rating,review_datetime_utc
5211,useful for buy things without cash very convenient and there are always cash back,14,5,2018-05-07T01:07:56.000Z
5214,worst app ever never used again,6,1,2018-05-07T06:01:15.000Z
5216,wow nice app mabils na gamitin,6,5,2018-05-08T04:14:42.000Z
5217,easy to register and i learn more in online bank,10,5,2018-05-08T04:15:40.000Z
5218,this app was ok at first pero nang ginamit ko gcash para mag load sa mama ko ang tagal ng confirmation inabot pa ng kinabukasan pati load ni mama pagka kinabukasan na rin nag si datingan ka tatlo ko inulit kaya ka tatlo ko siya na loadan hahai,48,1,2018-05-08T05:17:26.000Z
5220,i think they should add more features for more convenience,10,4,2018-05-08T05:39:57.000Z
5224,hello sana pwede na smart users dito i want to use this app sabi nila maganda im not a globe user sorry,22,1,2018-05-08T07:33:39.000Z
5225,such a waste of time,5,1,2018-05-08T08:10:41.000Z
5227,useful  i like it very much,6,5,2018-05-08T13:07:03.000Z
5228,nalowbat na phone ko kakaanta sa csr sagutin yung tawag ko even gcash care hindi nagrereply partida nagpuyat pa ko pero wala akong napala,24,1,2018-05-08T16:05:02.000Z
5229,i cant sign up cause its requesting for mpin where can i find mpin ,14,1,2018-05-08T16:37:31.000Z
5230,anung nangyayari sa gcash walang support sa fb hindi pa agad makarecieve ng cash sa paypal sana ibalik nyo ang gcash to coinsph para smooth ang transaction namin,28,3,2018-05-08T21:36:48.000Z
5231,gcash mo na yan,4,5,2018-05-08T23:56:11.000Z
5232,nice way i love it,5,5,2018-05-09T00:40:13.000Z
5233,i hope that the transaction record will update quickly and not after 24hrs,13,3,2018-05-09T02:05:52.000Z
5241,thank you for releasing the app,6,5,2018-05-09T08:48:12.000Z
5242,nice app pwede po kaya ulit ibalik ung 10 rebate pag nag buy load thanks po,16,4,2018-05-09T10:44:01.000Z
5243,i hate this new updates,5,1,2018-05-09T10:54:54.000Z
5249,suggestion sana pwede din ung regular load ipang cash in sa gcash account lets say ung shareaload or ung load mismo nung number sa account,25,4,2018-05-09T20:37:48.000Z
5250,prefix not in list  please fix it asap 0977,9,2,2018-05-09T23:45:26.000Z
5251,pa tulong naman po ayaw naman mag sign in eh yung email address ayaw,14,3,2018-05-09T23:52:39.000Z
5253,very helpfu yung gcredit nila incase of out of money,10,5,2018-05-10T01:08:13.000Z
5254,open ko gcash app ko ngaun lng bkit ayw mag open something went wrong lmlbas tpos clear data ko enter gcash  ko then ngtxt code sa gcash  ko enter ko code mali daw pero tama nman ung code ko ano po kya prob  answer pls ,45,5,2018-05-10T02:38:25.000Z
5255,great app though i would suggest to bring back the from load convert to gcash system it was a great setting would have used it alot would have saved us alot of time because not all places in the ph has stores designed for urban places so the only way for people living in urban places is for load to be converted to gcash just a suggestion  by the way bad ui for the send money button your customers might double tap sending twice the amount of money happened to me thrice i suggest a slide button that it over all its been great,104,4,2018-05-10T05:03:35.000Z
5258,i cant sign in causing of miss mpin,8,1,2018-05-10T08:03:35.000Z
5259,this app is not usefull its better to uninstall it,10,1,2018-05-10T08:20:22.000Z
5260,bwiset na app isang pinaka walang kwenta,7,1,2018-05-10T12:05:35.000Z
5261,i booked tickets on this app and paid for convenience fee the problem is they did not put what kind of movie we were going to watch to cut the story i had to rush going to sm marikina from pureza and to cut a meeting short i was told that i should checked for prices before booking which is a complete watse of time to check each movie shed each seats and to add to check for prices for the movie they also told me that theyll just fix the app i paid for the incovenience they have given me i also called their hotline that made me wait for more than 30mins only to tell me that i should call gmovies,123,2,2018-05-10T13:00:34.000Z
5264,tried paying using the app but it shows no fields available error,12,1,2018-05-10T15:25:54.000Z
5266,cant open it says oops there seems to be a problem please try again later please tell me what to do,21,2,2018-05-11T05:14:14.000Z
5268,poor customer service 5 days na di parin na validate account ko,12,1,2018-05-11T13:46:10.000Z
5269,i think its paster than other account,7,5,2018-05-11T13:52:02.000Z
5270,i think hes very good,5,5,2018-05-11T16:51:29.000Z
5271,i hope can work it good,6,5,2018-05-11T20:37:52.000Z
5276,5 stars for this apps,5,5,2018-05-12T07:50:01.000Z
5277,its one of the best app i ever downloaded,9,5,2018-05-12T08:12:05.000Z
5278,i submit my verification 3 times complete and i wait 24 hours then they said since your a minor you have to submit and your verification was incomplet  lol pls fix if im very very tired filling up those question many times pls make it quick,46,1,2018-05-12T11:00:31.000Z
5279,please gcash paki replayan email at messages ko  malaking pera nawawala sa gcash ko  pakibalik nyo  naghahanap buhay ako dito pangload tapos ganto lang ,24,1,2018-05-12T13:58:07.000Z
5282,napakabasura ng gcash promise di ko alam bakit pa may naga advertise sa napakabasura nyong telecom pati si drew pinaplastik lang din kayo ilang beses na ako nagsend ng request sa customer service nyo puro music lang tumutugtog basura talaga serbisyo nyo pati mga review sa inyo halos lahat negative,50,1,2018-05-12T14:53:06.000Z
5285,have a problem give it back my total balance,9,1,2018-05-12T16:03:21.000Z
5287,pwde sanang maupdate ang user profile mali kasi ang emailadd ko na lagay,13,3,2018-05-13T03:30:56.000Z
5289,it doesnt make sense even if i have a 500 php load in my gcash account but then i run out of data i wont be able to use my gcash unless i look for a wifi connection dumb app,40,3,2018-05-13T08:19:30.000Z
5291,your system is really annoyingi been to gcash store at sm nova today and still i cannot cash out my cash,21,1,2018-05-13T13:05:28.000Z
5292,very easy use to check my balance without going to atm ,11,4,2018-05-13T13:29:13.000Z
5293,good app  easy to pay transaction,6,5,2018-05-13T14:47:19.000Z
5294,hope for more gcash merchants even to school canteens and street vendors,12,5,2018-05-13T15:01:33.000Z
5295,very easy and convenient to use,6,5,2018-05-13T21:47:23.000Z
5296,i love this but i cant recieve 50 pesos from gcash,11,5,2018-05-14T00:01:06.000Z
5298,samei transfermoney frompaypal but ididnt receive themoney to my gcash butitdeductedto mypaypali also tried to tranferfrom my bankaccountsameprobdeducted butididnt receive any amount,22,1,2018-05-14T02:24:56.000Z
5299,sobrang bagal maka recieve ng load pag nag buy load ako sa smart,13,3,2018-05-14T02:27:44.000Z
5303,great and helpful app thank u,6,5,2018-05-15T01:45:07.000Z
5305,akala ko talaga very useful tong app na to lalo na c drew arellano pa endorser pero nkailang ulit na akong nag fill up ng verification form and it said within 24 hours dw pro hanggang ngayon nag fill up ulit ako ng verification form pero wla pa din,49,1,2018-05-15T05:54:41.000Z
5307,i cant register my number always saying theres a problem,10,1,2018-05-15T08:56:13.000Z
5309,not helpfulasked help from customer care hotline but directed me to globe store na nag advise sa akin na tumawag sa customer hotline nagpapasahod kau ng useless people,28,1,2018-05-15T12:26:06.000Z
5310,balik nyo na po yung load to gcash converter,9,3,2018-05-15T12:57:55.000Z
5311,its okay on some features but every time they update something goes wrong now i cant cash in using my mc,21,3,2018-05-15T22:39:35.000Z
5314,i just like it,4,5,2018-05-16T02:54:34.000Z
5315,it takes so long just to buy a load,9,2,2018-05-16T04:03:34.000Z
5316,ano batong g cash nag ss sign up ako ng number ko tapos nung tapos kona i type ying number ko palagi niyang sinasabi na theres something wrong with the prefix list,32,1,2018-05-16T04:15:29.000Z
5317,this is good apps,4,5,2018-05-16T05:09:23.000Z
5319,your app is great been using it ever since my prob is i cant change my email add and it belongs to someone else pls help to change email add i want to keep my acount,36,4,2018-05-16T07:17:21.000Z
5320,i love this apps,4,5,2018-05-16T08:18:12.000Z
5321,hnd nag rereply ung customer service nyo  ung gcash care  ilang araw na ung massege wala parin,17,1,2018-05-16T08:23:00.000Z
5326,its not working when i am not connected to wifi i cant pay using the app,16,3,2018-05-17T02:15:42.000Z
5329,this app is so good,5,5,2018-05-17T04:26:18.000Z
5331,i hate the operators no response for my problem about this apps i cant verify my account cause the operators wont reply my request,24,1,2018-05-17T09:18:08.000Z
5332,bwesit  pakiayus po 22 for your protection please delete immediately all messages containing your mpin how,16,5,2018-05-17T10:23:24.000Z
5333,its useful paying taxes i like it  nevers had a problems,11,5,2018-05-17T11:41:16.000Z
5334,cant update the app lol suddenly this app is incompatible with all of your devices haha,16,3,2018-05-17T11:48:03.000Z
5335,but my problem is my mpinhow to recover it i forgot mpin please help me i used to call the 2882 but nothing happen specially the 143 its no used o hope u can help me,36,1,2018-05-17T12:57:21.000Z
5336,didnt received 50 from whos gaving her referral to me  it has been a month since then and i was actually verifying my account for petes sake for how many times that i didnt count  also wanting it to uninstall but i am actually holding my temper for it to have that 50 php but still nothing  then now its strange that i got a text msg from gcash having 20 php for gcash referral that was a quite surprise even its not what i am waiting though  i kinda look like stupid enough and thanks gcash for 20php i maybe waiting whose gonna used my referral for me to collect 20php it can be useful ill just wait,119,2,2018-05-17T13:21:50.000Z
5337,ive been waiting for 20 minutes and theirs no code sent,11,1,2018-05-17T13:34:16.000Z
5339,please verify my account,4,1,2018-05-17T17:14:27.000Z
5340,cant enter in their app,5,1,2018-05-17T18:28:35.000Z
5341,i dont think this is reliable in paying bills in the govt,12,4,2018-05-17T22:37:43.000Z
5342,i think its useful to send money or paybills,9,5,2018-05-18T03:27:07.000Z
5343,your customer service sucks ur not helpful,7,1,2018-05-18T03:52:41.000Z
5345,great for giving us free load thanks,7,4,2018-05-18T09:46:11.000Z
5350,why i cant load or pay bill it always says maintenance or some error,14,1,2018-05-19T00:25:42.000Z
5351,i cant open this apps,5,1,2018-05-19T02:32:13.000Z
5353,whut the duckk g cash i cant sign in my phone no 63 wahttttt,14,1,2018-05-19T03:12:05.000Z
5354,worst experience nakailang tawag na ako to follow up the cashback na sabi sa promo mag 2 months na wala pa din negative vibes lang ang dala ng app na ito,31,1,2018-05-19T05:38:39.000Z
5359,when i try to create my mpin on messenger theres an error saying it cant do it right now fix please,21,1,2018-05-19T12:57:38.000Z
5361,its easy to use and its very helpful to me,10,5,2018-05-19T13:35:16.000Z
5363,hndi po to usefulilang weeks na kmi nag ka kaproblema sa g cash especially transferring money from paypal to g cash please solve ds asap mawawala na ung temper ko sa inyo g cash customer service hotline nyo wala ding help ano ba,43,1,2018-05-19T22:35:28.000Z
5365,best app for bills payment eload and i used it for purchasing online locally and abroad ,16,5,2018-05-20T04:50:26.000Z
5366,if i could only rate this trash 0 then why not it is just that google play is very considerate the app devs who are using it gcash has no customer service gcash care in facebook is just a display and spammer gcashs cash in from paypal does not work you will only waste your time downloading and using this app i do not recommend using this or any of its services,72,1,2018-05-20T05:18:47.000Z
5368,i have receive 250 pesos from gcash just for sharing a link thank you,14,5,2018-05-20T07:28:56.000Z
5370,i just wish theres a feature that you can buy load offline because mobile data eats away the load that you bought if you didnt buy a promo,28,3,2018-05-20T09:51:25.000Z
5371,if you see this review i want to tell that my number is 11 numbers but when i want to sign up the max capacity is only 10 digit please fix this gcash thank you ill give this 5 stars when you fix it bye,45,2,2018-05-20T10:28:17.000Z
5372,i want this app useful for me,7,5,2018-05-20T10:37:34.000Z
5373,gcredit sucks it discriminate clients,5,1,2018-05-20T14:58:53.000Z
5376,this appis really good and cool,6,5,2018-05-21T02:37:48.000Z
5377,i cant log in always saying theres something wrong with the prefix list,13,1,2018-05-21T03:39:53.000Z
5379,always say  gcash is not responding  and i didnt the 50 thingy fake,13,1,2018-05-21T09:21:37.000Z
5382,whats the problem with gcash i trasferred my remaining balance from my paypal account it has been deducted and yet not credited to my gcash account can you please assist me with this issue,34,3,2018-05-21T15:14:11.000Z
5386,dear globe sana ung transaction history updated lagi hindi yung makikita pa after 24 hours hindi ko tuloy nattrack yung transactions ko kasi maghihintay pa ko ng isang araw ngload ako nagdeduct kayo saken tapos walang pumasok sa niloadan ko at wala ding confirmation txt sakin,46,4,2018-05-22T06:44:31.000Z
5387,di ko ma open yung app nakalagay lang dun na theres something wrong with the prefix list,17,1,2018-05-22T06:55:51.000Z
5389,i cant sign in,4,1,2018-05-22T08:19:17.000Z
5395,grabe sa tatag ng customer service walang maitulong dahil di ka makakonek sa una palang been trying to call since last night to no avail nakakaasar,26,1,2018-05-23T02:49:45.000Z
5398,it really irritates me that when i load on other network it always take a long long long long long time to load very poor service,26,1,2018-05-23T07:04:38.000Z
5400,i think it is easier to use,7,5,2018-05-23T09:53:27.000Z
5401,ahmm where do i get my zip code what is it,11,3,2018-05-23T11:25:18.000Z
5404,paano magamit ung referral code ko,6,3,2018-05-23T22:42:44.000Z
5405,first my paypal withdrawal did not reflect and now it is not allowing me to cash in from my card no one from your customer service can actually be contacted i tried all ways to speak with you guys but even in the globe store itself no one can explain the reason as to why this is happening my account is fully verified and i under went the kyc process this is too deceptive,74,1,2018-05-24T00:22:10.000Z
5407,i cannot register my smart number,6,2,2018-05-24T01:19:10.000Z
5408,good day po nd po b pd mbilis n transaction when it comes to buy load to other network,19,5,2018-05-24T01:36:28.000Z
5409,amazing apps thank you gcash,5,5,2018-05-24T04:05:10.000Z
5410,pwede baag cash out sa gcash,6,2,2018-05-24T04:53:01.000Z
5412,loading smart is so slow fix that plz,8,1,2018-05-24T11:31:47.000Z
5413,i loved it actually,4,5,2018-05-24T14:09:37.000Z
5414,kahit na tama yung pin ko ayaw maputa sa wallet ko dalawang number kona nagamit ko ayaw parin,18,1,2018-05-24T15:13:58.000Z
5415,i have to delete the app rebate is okay but it take hours for the prepaid load to be credited to my phone when using gcash there was one time when i ended up loading multiple times as i thought the app was not working,45,1,2018-05-24T17:42:43.000Z
5417,for me this app is usefull ive been using it back in 2017 untill now and i already reffer my friends to use this too and i recieved my refferal bonus i already got my card too thanks to this usefull app i can do save money,47,5,2018-05-24T18:03:54.000Z
5418,not verified i dont why my acct cant be verified there is no text box for suffixes for names,19,1,2018-05-24T22:05:06.000Z
5419,thumbs up tlaga ako sa app na to promise napaka convenient salamat sa gcash khit wala wala akong data nakakpag paload parin ako through 143 thanks ,26,5,2018-05-24T23:46:54.000Z
5420,hindi ako maka register laging fix prefix buset,8,1,2018-05-25T00:30:04.000Z
5423,always keep says sorry your previous transaction is still being processed please try again later,15,1,2018-05-25T04:02:08.000Z
5426,easy to use and very usefuli love this app so much,11,5,2018-05-25T07:40:27.000Z
5428,easy to use  very helpful ,5,5,2018-05-25T10:02:15.000Z
5430,how can i create my own account to gcash,9,3,2018-05-25T11:09:50.000Z
5432,i dont get m pin,5,1,2018-05-25T12:13:09.000Z
5433,pag kailangan mo mag log in ayaw mag log in there seems to be a problem please try again later lagi lumalabas nakakainis,23,1,2018-05-25T14:45:25.000Z
5435,gcash care not responding i cant even recover my mpin thus when i signed up for this app i didnt receive an mpin now it was asking me my mpin where i dont even know my mpin i tried to contact gcash care on facebook but its been months i dont received any reply from them was there any problem about the app,63,1,2018-05-25T16:10:43.000Z
5438,i entered my number multiple times and tried other number but still not accepting it and says prefix blahblah i checked it i googled it and more but it doesnt work,31,1,2018-05-26T02:19:12.000Z
5439,good rebates tnx gcash,4,5,2018-05-26T08:01:12.000Z
5441,bat ganun ilang araw lang akong d nag log in sa gcash account ko tas pag bukas ko wala ng nakalagay para sa referal code ko  please pakiayos,28,5,2018-05-26T09:49:46.000Z
5442,i cant login a prompt pops up asking me to try later,12,2,2018-05-26T10:27:57.000Z
5444,i filled up the verification form for about 5times already,10,1,2018-05-26T11:01:38.000Z
5445,d ko rin maopen acount ko scammer ata to mas maganda pa coins ph kasi safe tapos 10 rebate dito 5  lang pero pa fix ng account ko d ko maopen ,31,1,2018-05-26T11:34:33.000Z
5446,nice where can buy the gcash card,7,5,2018-05-26T11:55:17.000Z
5447,poor service cant even help me with my mpin i cant access my account,14,3,2018-05-26T13:38:56.000Z
5450,latest version daming errors cant process anything,7,2,2018-05-26T15:35:22.000Z
5451,magulo system and protocollalo na pagdating sa cashbackgcash care at email ads ng gcash no goodpagdating nmn sa buy load 48 years bago dadating ang load ng ibang networktsktsktsk,29,1,2018-05-26T15:40:25.000Z
5452,good for faster transaction,4,5,2018-05-26T15:43:27.000Z
5453,stupid gcash i did enter my referral code in my friend phone then after that i didnt receive any amount the heck i wast time idiot,26,1,2018-05-26T16:34:25.000Z
5454,di ko maopen gcash ko ibalik nyo pera ko,9,1,2018-05-26T17:16:46.000Z
5455,this app sucks you must allow your contact sms and location and if you click deny the app will start to glich like what the f gcash why you must know the location and contacts of your customer dont we have freedom to make to not allow you to have our location and contacts ugh,55,1,2018-05-26T20:00:06.000Z
5457,wla naman kwenta bawal raw mag borrow load kasi ndi globe or tm e naka globe ako tsk,18,1,2018-05-27T06:39:20.000Z
5458,i dont understand why your system would not notify me if i needed to renew my pin another thing is that it keeps asking for a pin i last used but wont accept it also your customer service 2882 which is the number you advertise in case of concerns does not help at all i need a customer service rep but all im getting is all other options except the one i need,73,1,2018-05-27T07:29:38.000Z
5460,gcash verification processing is still slow as snail please fix it,11,1,2018-05-27T10:27:38.000Z
5462,my accounnt was bloked why t gcash care cant help me to fix it grrr,15,1,2018-05-27T11:33:29.000Z
5463,mas ma buti pa ang paymaya,6,3,2018-05-27T11:59:11.000Z
5464,thanks for creating appvery easy cool and relaxover,8,5,2018-05-27T13:34:08.000Z
5467,i want to try this app,6,5,2018-05-27T19:26:36.000Z
5470,useful daw naka ilang send na sa cellphone ko yung verification code incorect parin yung code walang kwenta,18,1,2018-05-28T03:15:26.000Z
5471,easy acces pay bills,4,4,2018-05-28T03:34:46.000Z
5472,the app is good but pls add a psbank to gcash option in the cash in tab,17,5,2018-05-28T05:05:53.000Z
5474,very good for transactions,4,5,2018-05-28T12:35:53.000Z
5475,it crashes 90 of the time,6,1,2018-05-28T13:21:33.000Z
5476,great appeasy to cash in and buy load with rebate but now i couldnt sign in always said error i after the update i uninstall and re install but have the same problem plsss fix it to continue my easy payments using gcash thank you,45,5,2018-05-28T15:00:41.000Z
5478,got my referral rewards a lot of times already great app,11,5,2018-05-29T05:40:25.000Z
5480,the verification is not working i have ascreen shot it diddnt work,12,1,2018-05-29T07:27:16.000Z
5484,how to log in,4,4,2018-05-30T01:33:28.000Z
5485,this apps is my favorite,5,4,2018-05-30T02:15:11.000Z
5487,wag kayong gumamit neto masasayang lang pera nyo ingat din,10,1,2018-05-30T06:41:22.000Z
5489,whats happening i cannot recover my mpin then i call to 2882 but nothing happened,15,2,2018-05-30T11:56:19.000Z
5490,this is a wonderfull app,5,5,2018-05-30T12:01:06.000Z
5494,this is good for me,5,5,2018-05-30T14:15:17.000Z
5497,how i get 50 free load,6,1,2018-05-31T01:34:57.000Z
5498,pano po ito sabi lang oops theres something trouble try again later nakailan beses na po ako kad 1hour plss pano po ito,23,5,2018-05-31T10:31:43.000Z
5499,i cant open it by the way what is mpin i cant register,13,2,2018-05-31T10:49:35.000Z
5500,hassle free effortless bills payment thank you,7,5,2018-05-31T13:47:09.000Z
5502,add option to pay kuryente load,6,5,2018-05-31T16:01:51.000Z
5504,why mcwd cant accept payments and some other store branches dont have gcash qr code payments but this apps really responsive i still loved globe,25,4,2018-05-31T23:47:15.000Z
5506,thanks for this app convenience is a comfort,8,5,2018-06-01T01:52:51.000Z
5508,i cant login because i forgot mpin,7,1,2018-06-01T02:15:00.000Z
5510,5 star para mabigyan ako ng money,7,5,2018-06-01T02:27:29.000Z
5512,escalation process and timeframe for the resolution sucksbig time,9,1,2018-06-01T02:33:18.000Z
5513,plss add steam wallet converter so we can buy steam walletsteam wallet codes,13,4,2018-06-01T02:42:14.000Z
5514,hated the new updatei have paying apps that only pays 1dollar each game or 5dollars and now we have to wait till it reaches to 10dollarsfor what the old version was very helpful and convenientthe new update sucks better find another app that serves just like gcashim gonna tell my other friends toobtwwe are the majority group who uses gcash to cash inif we can no longer use the without minimum feebetter switch to another 1,76,1,2018-06-01T02:44:33.000Z
5515,nice app deserve 5 star,5,5,2018-06-01T02:47:30.000Z
5517,ayaw gumana nakalagay theres a problem please try again later ,10,2,2018-06-01T03:42:41.000Z
5520,its okay but sometimes if u order online and u have mistake in the letter of ur name your order and payment will be floating status and it will refund 3045days,31,3,2018-06-01T04:50:22.000Z
5521,this is app is great,5,4,2018-06-01T04:57:44.000Z
5522,what the heck gcash,4,1,2018-06-01T05:01:14.000Z
5523,everyday ako nagsasubmit ng verification tapos 2 lang ang nangyayari hindi tinatanggap id ko or walang reply akala ko pa naman mapapadali ang pag trabsfer ko ng pera sana nag remittance na lang ako,34,1,2018-06-01T05:08:12.000Z
5526,its great really i buy my load in app then use it as my personal savings account gladly uf we verify the app on our own and it doesnt work we can go over the counter and their customer service personnel helps us ti successfully verify there are still a few bugs but tge app is really helpfuk though improve more,61,5,2018-06-01T05:42:23.000Z
5527,you are a bunch of scammers you just took my money after i cash in from paypal and your customer service are very unprofessional,24,1,2018-06-01T05:48:42.000Z
5528,it was ok before but when i am about to cash in to my paypal account i cannot cash in and there is no customer support,26,2,2018-06-01T06:17:42.000Z
5529,this is great app,4,5,2018-06-01T06:33:08.000Z
5531,very good appits easy to use especially paying bills and load,11,5,2018-06-01T06:39:40.000Z
5532,very useful i just experience often log in error hoping for stability,12,4,2018-06-01T06:54:49.000Z
5533,isa rin ito sa scam app ng globe nag refer ako ng friends tapos 2 weeks wala parin isa rin itong panira sa pilipinas kaya di umunlad bansa natin o baka hindi nila ma afford sa dami ng narefer kong friends,41,1,2018-06-01T07:02:04.000Z
5534,no hassle thanks g cash,5,4,2018-06-01T07:42:03.000Z
5535,the best ever easy way of paying your bills and buying loads,12,5,2018-06-01T07:50:29.000Z
5536,hope na ma process yung other networks instantly when it comes to buying load kasi minsan umaabot ng morethan 1 hr kakahintay,22,4,2018-06-01T08:13:38.000Z
5537,it doesnt connect to paypal at all and it crashes most of the time but the rest are okay,19,2,2018-06-01T08:32:43.000Z
5538,kindly fix he cash in issue,6,2,2018-06-01T09:19:28.000Z
5539,very useful and easy to use i love it but what is gcredit,13,5,2018-06-01T09:20:24.000Z
5540,this app can make you rich,6,5,2018-06-01T09:27:09.000Z
5541,whats the point of using this trash kahit kelan wala talaga kayong kwenta load to gcash inalis nyo nagpaypal kayo then min 500 na ngaun bllsht tlaga kayo kahit ung details ko tama naman amg pagkaka type then bglang wrong spelling ang gcredit nyo napaka walang kwenta cus service sa fb paulit2 lang na sagot kahit ilang ulit na isend amg details basura kayo gcash,65,1,2018-06-01T09:40:42.000Z
5542,always please try again evwn i have connection,8,1,2018-06-01T09:42:51.000Z
5543,good app but it is excellent if it is free data app more helpful you can use it anywhere even without data,22,4,2018-06-01T10:12:41.000Z
5544,very covinient to use,4,5,2018-06-01T10:28:23.000Z
5545,thank you gcash for making transactions easier ,7,5,2018-06-01T11:15:41.000Z
